,nombre_artista,bio,listeners,playcount,similar
120,Animal Sun," <a href=""https://www.last.fm/music/Animal+Sun"">Read more on Last.fm</a>",50484,885209,"['Foreign Figures', 'Betcha', 'Dreamers', 'Cazadores', 'Naked Cameo']"
121,The Jins,"The Jins are a grunge band from Vancouver, British Columbia with strong 90's Seattle sound influences. <a href=""https://www.last.fm/music/The+Jins"">Read more on Last.fm</a>",138131,1593427,"['Nirvana', 'Aberdeen is Dead', 'Kurt Cobain', 'SAP', 'Local H']"
122,Lil Peep,"Lil Peep (born Gustav Åhr) was an American recording artist hailing from Long Island, New York. He was cited as one of the primary artists responsible for the post-emo revival with his style of hip hop which came to be known as emo trap. After a slight delay, his debut album Come over When You're Sober, Pt. 1 was released on August 15, 2017. Due to a possible drug overdose, he passed away on November 15, 2017 (aged 21).

Lil Peep was described as a ""SoundCloud rapper"", and his musical style is considered lo-fi rap or emo-trap. <a href=""https://www.last.fm/music/LIL+PEEP"">Read more on Last.fm</a>",1824244,287827217,[]
123,The Reytons,"The Reytons are an alternative rock band from Sheffield, South Yorkshire, United Kingdom, bustling with working man grit and no bulls**t ideals. 

They have released four EPs thus far: It Was All So Monotonous (2017), Kids Off The Estate (2017), Alcopops & Charity Shops (2018) and May Seriously Harm You And Others Around You (2021). <a href=""https://www.last.fm/music/The+Reytons"">Read more on Last.fm</a>",192125,3158433,"['The Snuts', 'The Sherlocks', ""The K's"", 'The Family Rain', 'corella']"
124,Royal Republic,"Royal Republic is a Swedish rock band formed in Malmö in late 2007. The band consists of guitarist/lead singer Adam Grahn, guitarist Hannes Irengård, bass guitarist Jonas Almén and drummer Per Andreasson.

In late 2008 the band began recording their first album at Beach House Studios in Malmö, Sweden, with producer Anders Hallbäck. The album was completed in 2009 and all songs were mixed at ToyTown Studios by Stefan Glaumann (Rammstein, Europe, Def Leppard, Backyard Babies, Deathstars, etc.). <a href=""https://www.last.fm/music/Royal+Republic"">Read more on Last.fm</a>",244039,8817477,"['Danko Jones', 'Thundermother', 'The Subways', 'Airbourne', 'Billy Talent']"
125,Barns Courtney,"Barns Courtney (born Barnaby George Courtney on 17 November 1990 in
Aylesbury, England) is an English singer, songwriter and musician.

Courtney spent a large part of his childhood in Seattle,USA, before returning to home country UK as a 15-year-old. This change of scenery comes across as clearly in his eclectic mix of US blues-rock, hip-hop and grunge with British indie melodic sensibilities, as it does in his hybrid US-British twang.

Playing in various projects and bands growing up whilst developing his sound <a href=""https://www.last.fm/music/Barns+Courtney"">Read more on Last.fm</a>",454767,8680312,"['The Unlikely Candidates', 'Bryce Fox', 'KONGOS', 'grandson', 'Rafferty']"
126,The Voidz,"The Voidz (formerly Julian Casablancas + The Voidz) is an experimental rock band. They consist of Julian Casablancas (vocals), Jeramy ""Beardo"" Gritter (guitar), Amir Yaghmai (guitar), Jacob ""Jake"" Bercovici (bass, synthesizers), Alex Carapetis (drums), and Jeff Kite (keyboards).

Tyranny, their debut album, reached 50th in NME's Top 50 Albums of 2014 list.

Formation, Tyranny (2013–2016)
Jeff Kite, Alex Carapetis and Jake Bercovici had all worked with Casablancas previously. <a href=""https://www.last.fm/music/The+Voidz"">Read more on Last.fm</a>",483048,16148720,"['Julian Casablancas', 'The Strokes', 'Albert Hammond, Jr.', 'CRX', 'Benches']"
127,The Lunar Effect,"
Started by solo artist Mark Fuller and DeepSeaGreen guitarist Jon Jefford, The Lunar Effect is a project bringing back dirty, raw, unspoiled, homemade grunge. 

After noticing an abundance of over-edited and over-produced music emerging from our shores we decided to start doing something that has always been close to our hearts, making gritty punk, new wave songs, cheaply recorded and unashamedly imperfect.
  <a href=""https://www.last.fm/music/The+Lunar+Effect"">Read more on Last.fm</a>",12495,76853,"['Hazemaze', 'Sons of Arrakis', 'Mothership', 'Big Scenic Nowhere', 'Mount Hush']"
128,Gary Clark Jr.,"Gary Clark Jr. (born February 15, 1984) is an American guitarist and actor based in Austin, Texas. Described as being the future of Texas blues, Clark's resume has included sharing the stage with various legends of rock and roll. He has stated that he is ""influenced by blues, jazz, soul [and] country, as well as hip hop"". Clark's musical trademarks are his extremely fuzzy guitar sound and smooth vocal style.


GARY CLARK JR.began playing guitar in 1996 at the ripe young age of 12. <a href=""https://www.last.fm/music/Gary+Clark+Jr."">Read more on Last.fm</a>",495410,7392007,"['Kenny Wayne Shepherd Band', 'Marcus King', 'Fantastic Negrito', 'Eric Gales', 'Joe Bonamassa']"
129,A Day To Remember,"A Day to Remember is a post-hardcore band from Ocala, Florida, founded in 2003 by guitarist Tom Denney and drummer Bobby Scruggs. They are mainly known for their unusual amalgamation of metalcore and pop punk as a musical style, as well as playing other styles. The band consists of vocalist Jeremy McKinnon, rhythm guitarist and backing vocalist Neil Westfall, bassist Joshua Woodard, percussion and drummer Alex Shelnutt and lead guitarist Kevin Skaff. <a href=""https://www.last.fm/music/A+Day+to+Remember"">Read more on Last.fm</a>",1749713,125283890,"['Beartooth', 'Silverstein', 'We Came as Romans', 'Four Year Strong', 'Blessthefall']"
130,Whirr,"Whirr is an American shoegaze band from San Francisco, California, United States. They formed in 2010, originally as Whirl. The name was created by the original drummer, Sergio Miranda, in the midst of recording the band's first demos as a nameless project. It was a homage to all the bands of ""the Scene That Celebrates Itself” (Lush, Ride, Moose, Medicine, Lilys, etc.). They had to legally change the name after a woman performing acoustic covers of Black Sabbath songs trademarked ""Whirl"" and threatened a lawsuit. <a href=""https://www.last.fm/music/Whirr"">Read more on Last.fm</a>",593870,25895141,"['Glare', 'Nothing', 'All Under Heaven', 'Trauma Ray', 'Narrow Head']"
131,Electric Callboy,"Electric Callboy (formerly known as Eskimo Callboy) is a German metalcore/electronicore band formed in Castrop-Rauxel in 2010. The band consists of former lead singer of To the Rats and WolvesNico Sallach, who replaced longtime lead singer Sebastian ""Sushi"" Biesler who left the band in early 2020. The rest of the band includes vocalist and keyboardist Kevin Ratajczak, the guitarists Daniel Haniß and Pascal Schillo, bassist Daniel Klossek and drummer David Friedrich. <a href=""https://www.last.fm/music/Electric+Callboy"">Read more on Last.fm</a>",245610,14617002,"['To the Rats and Wolves', 'Samurai Pizza Cats', 'Ghøstkid', 'BABYMETAL, Electric Callboy', 'Eskimo Callboy']"
132,She Past Away,"She Past Away is a dark wave band from Bursa, Turkey. The group was formed by Volkan Caner (vocal/guitar) and Idris Akbulut (bass) in 2006. With the live participation of Doruk Ozturkcan in electronic drums, the band was totally shaped by the end of 2009.

Idris Akbulut left She Past Away in 2015 and was replaced by Doruk Ozturkcan as a permanent member. 

Clashing gothic lyrics with buzzsaw guitars, allegedly broken vocals and sensory drum effects <a href=""https://www.last.fm/music/She+Past+Away"">Read more on Last.fm</a>",191409,5465002,"['Twin Tribes', 'Selofan', 'Lebanon Hanover', 'The Agnes Circle', 'Bragolin']"
133,Better Oblivion Community Center,"Better Oblivion Community Center is a collaborative project between Conor Oberst (Bright Eyes, Desaparecidos, Conor Oberst and the Mystic Valley Band) and Phoebe Bridgers (boygenius) currently signed to Dead Oceans. After a cryptic media campaign featuring cult-like messaging on flyers and bus stop benches, Better Oblivion Community Center released its surprise, eponymous LP on January 23, 2019 with a debut appearance on the Late Show with Stephen Colbert. <a href=""https://www.last.fm/music/Better+Oblivion+Community+Center"">Read more on Last.fm</a>",313102,9301696,"['boygenius', 'Phoebe Bridgers', 'Julien Baker', 'Conor Oberst', 'Lucy Dacus']"
134,The Growlers,"The Growlers are an American band from Southern California. They began their career in the Orange County city of Dana Point, California in 2006. They are currently based in Costa Mesa.  The band is currently composed of singer Brooks Nielsen, lead guitarist Matt Taylor and keyboard player/guitarist Kyle Straka.  They have released seven albums, several EPs and a number of singles. The band's sound has been described as ""a trademark style of music that somehow combines surf, pop, rock and beat"" which has been labeled ""Beach Goth"". <a href=""https://www.last.fm/music/The+Growlers"">Read more on Last.fm</a>",757673,21886597,"['The Buttertones', 'Tijuana Panthers', 'Mystic Braves', 'Allah-Las', 'The Pesos']"
135,Yogi Lang,"Yogi Lang is the singer of the German progband RPWL.
He released his first solo-album ""No Decoder"" in 2010

http://www.yogilang.com <a href=""https://www.last.fm/music/Yogi+Lang"">Read more on Last.fm</a>",39580,345049,"['The Black Noodle Project', 'Blind Ego', 'Amarok', 'Karfagen', 'RPWL']"
136,Boyscott,"Boyscott was formed in 2015 by Scott Hermo Jr. (vocals, guitar, bass, synth), Emma Willer (aka Lazy Trail), and Conor Ryan. They released their debut album, Goose Bumps, on November 17, 2015. <a href=""https://www.last.fm/music/Boyscott"">Read more on Last.fm</a>",336815,3448320,"['The Buttertones', 'Hot Flash Heat Wave', 'Jaded Juice Riders', 'The Growlers', 'Beach Fossils']"
137,The Beefs," <a href=""https://www.last.fm/music/The+Beefs"">Read more on Last.fm</a>",20896,114303,"['Jfarrari', 'Viagra Boys', 'Last Train', 'alone in my room', 'Triggerfinger']"
138,The Strokes,"The Strokes are an alternative rock band, known for their distinctive sound and cultural impact, particularly in the early 2000s.

Members
Julian Casablancas (vocals), Nick Valensi (guitar), Albert Hammond Jr. (guitar), Nikolai Fraiture (bass), and Fabrizio Moretti (drums)

Formation
The founding process of The Strokes was a serendipitous convergence of childhood connections and a shared musical vision. Julian Casablancas, Fabrizio Moretti, and Nick Valensi, childhood friends with varying musical experiences, came together in the late '90s. <a href=""https://www.last.fm/music/The+Strokes"">Read more on Last.fm</a>",5130201,387169429,"['The Voidz', 'Julian Casablancas', 'Albert Hammond, Jr.', 'Arctic Monkeys', 'Interpol']"
139,Biig Piig,"Jessica Smyth, known by the stage name Biig Piig, is an Irish singer and rapper, based in West London. She performs in English and Spanish and is signed to RCA Records. Smyth was born in Cork, Ireland. She lived in Spain from the age of four to twelve, after her family had moved on advice that the climate would be better for her brother's asthma. Upon moving with her family back to Ireland, she was at first able to read and write only in Spanish and had to reintegrate into Irish culture. <a href=""https://www.last.fm/music/Biig+Piig"">Read more on Last.fm</a>",441991,6408496,"['Greentea Peng', 'Lava La Rue', 'Hope Tala', 'Arlo Parks', 'yukimi']"
140,All Time Low,"All Time Low are an American pop punk band formed in Baltimore, Maryland, United States in 2003. When Alex Gaskarth (lead vocals, rhythm guitar, keyboards) was in middle school, he was moved from private school to public school, where he met Jack Barakat (lead guitar, backing vocals), and put the band together; later recruiting Rian Dawson (drums, percussion), and Zack Merrick (bass guitar, backing vocals). The band's name came from a line in the New Found Glory song Head On Collision. <a href=""https://www.last.fm/music/All+Time+Low"">Read more on Last.fm</a>",2234438,109659835,"['Simple Creatures', 'Mayday Parade', 'State Champs', 'The Maine', 'We the Kings']"
141,Theophilus London,"Theophilus London is a Brooklyn, USA based hip hop artist with heavy electro influences.

London released his debut mixtape JAM! in 2008. In 2009 he collaborated with MachineDrum for his second mixtape This Charming Mixtape which brought London to a wider audience. In 2010 London released the mixtape I Want You which features covers of classic songs. 

London's track Flying Overseas (featuring Devonté Hynes and Solange Knowles) enjoyed popularity with music bloggers in November 2010.  <a href=""https://www.last.fm/music/Theophilus+London"">Read more on Last.fm</a>",520888,6842226,"['A$AP Mob', 'GoldLink', 'Rejjie Snow', 'Raury', 'Vic Mensa']"
142,Desakato,"Desakato is a band from Llanera (Asturias, Spain), formed in 2003 as an initiative from Pablo and Mario (singer/rythm guitar and bass respectively) who had been leaping from group to group not finding a sound they liked. They teamed up with guitarist Gabri and started playing covers and writing their own songs. Drumless, Pablo asked his brother Héctor to join up. Falu joined up as songwriter and helped with composition, as well as backup vocals and some solo songs. <a href=""https://www.last.fm/music/Desakato"">Read more on Last.fm</a>",12091,617844,"['Kaotiko', 'Boikot', 'Lendakaris Muertos', 'El Último Ke Zierre', 'Piperrak']"
143,Hollow Ship,"Hollow Ship is a five-piece psychedelic rock band from Gothenburg.
Their groovy music mixes sounds of early British psych with mindexpanding funky afro-rock.
Sweet analogue sonics of the 60s are fused with modern technique creating their own distinctive sound. <a href=""https://www.last.fm/music/Hollow+Ship"">Read more on Last.fm</a>",49589,160287,"[""Aunt Cynthia's Cabin"", 'Glyders', 'Psychedelic Porn Crumpets', 'Mount Hush', 'Ghostwoman']"
144,Guns N' Roses,"Guns N' Roses are an American hard rock band founded in Los Angeles, California in 1985. 

The band has released six studio albums: Appetite For Destruction in 1987, G N' R Lies in 1988, Use Your Illusion I and Use Your Illusion II in 1991, ""The Spaghetti Incident?"" in 1993 and, after 15 years and with frontman Axl Rose and keyboardist Dizzy Reed being the only members left from the previous lineup, Chinese Democracy in 2008. They also released three EP's in 1986, 1988, and 1993 and two live albums, in 1999 and 2014. <a href=""https://www.last.fm/music/Guns+N%27+Roses"">Read more on Last.fm</a>",4715996,174878325,"['Mötley Crüe', 'Slash', 'Aerosmith', 'Skid Row', 'Velvet Revolver']"
145,Khruangbin,"Khruangbin (IPA: /ˈkɹʌŋbɪn/) is an American three-piece band from Houston, Texas, formed of Laura Lee on bass, Mark Speer on guitar, and Donald Johnson on drums. The trio's first single 'A Calf Born In Winter' was released in May 2014 by Late Night Tales offshoot Night Time Stories, and saw support from DJs Zane Lowe, Cerys Matthews, Tom Ravenscroft, Gideon Coe and magazines as musically diverse as Test Pressing, For Folks Sake, i-D, The 405 and Ransom Note. <a href=""https://www.last.fm/music/Khruangbin"">Read more on Last.fm</a>",938045,38816721,"['Arc De Soleil', 'Glass Beams', 'BALTHVS', 'Menahan Street Band', 'Surprise Chef']"
146,AC/DC,"AC/DC are an Australian rock band formed in Sydney in 1973 by Scottish-born brothers Malcolm and Angus Young. Their music has been variously described as hard rock, blues rock, and heavy metal, but the band calls it simply ""rock and roll"".

AC/DC underwent several line-up changes before releasing their first album, 1975's High Voltage. Membership subsequently stabilised around the Young brothers, singer Bon Scott, drummer Phil Rudd, and bassist Mark Evans. <a href=""https://www.last.fm/music/AC%2FDC"">Read more on Last.fm</a>",4211051,196365866,"['Airbourne', 'Ozzy Osbourne', 'Motörhead', 'Van Halen', 'Kiss']"
147,Ozzy Osbourne,"John Michael ""Ozzy"" Osbourne (born 3 December 1948) is an English singer, songwriter, and television personality. He rose to prominence during the 1970s as the lead vocalist of the heavy metal band Black Sabbath, during which period he adopted the nickname ""Prince of Darkness"". Born and raised in Birmingham, Osbourne became a founding member of Black Sabbath in 1967, and sang on every album from their debut in 1970 to Never Say Die! in 1978. The band was highly influential on the development of heavy metal music <a href=""https://www.last.fm/music/Ozzy+Osbourne"">Read more on Last.fm</a>",2652867,74138614,"['Black Sabbath', 'Dio', 'Judas Priest', 'Alice Cooper', 'Accept']"
148,Cobardes," <a href=""https://www.last.fm/music/cobardes"">Read more on Last.fm</a>",1123,10122,"['Linaje', 'el Drogas', 'El Vicio Del Duende', 'Malaputa', 'TREGUA']"
149,Will Paquin,"Will Paquin (born August 1, 1999) is an American musician and singer originating from Boston. He is recognized for his unique guitar skills and captivating musical style.

Paquin's musical journey commenced during his childhood when he began playing the guitar. Influenced by prominent jazz guitarists such as Wes Montgomery and Kenny Burrell, he developed a distinct guitar style characterized by intricate and captivating riffs.

In 2020, Paquin gained prominence through TikTok. <a href=""https://www.last.fm/music/Will+Paquin"">Read more on Last.fm</a>",540782,7305435,"['Mickey Darling', 'Still Woozy', 'Frances Forever', 'Miniature Tigers', 'grentperez']"
150,Amenoskuarto,"AmenoSKuartO is a spanish rock band influenced by other rock bands like Extremoduro or Marea...

Go to http://amenoskuarto.com/ and download their songs. <a href=""https://www.last.fm/music/Amenoskuarto"">Read more on Last.fm</a>",4574,30140,"['Los Reconoces', 'Silencio Absoluto', 'Forraje', 'KARIH-KATURA', 'Zutik']"
151,Noan," <a href=""https://www.last.fm/music/Noan"">Read more on Last.fm</a>",8800,94258,"['DellaCruz', 'Quique Niza', 'Paula Koops', 'Roger Padrós', 'Enol']"
152,VOILÀ,"Luke Eisner and Gus Ross make up the duo, VOILÀ. Respectively from Wisconsin and London, the Emmy nominated pair self-produce, write & perform their own songs. They released their third album, Glass Half Empty last year and just announced the release date for their fourth album The Last Laugh. With over 450 million global streams, the fully independent band's commitment to a magically themed aesthetic has resulted in the creation of a loyal global community that call themselves ""the magicians.""  <a href=""https://www.last.fm/music/+noredirect/Voil%C3%A0"">Read more on Last.fm</a>",203881,6714051,[]
153,Chubby Checker,"Chubby Checker is the stage name of Ernest Evans (born 3 October 1941), an American singer-songwriter best known for popularizing the dance The Twist with his 1960 song ""The Twist"". In September 2008, ""The Twist"" topped Billboard's list of the most popular singles to have appeared in the Hot 100 since its debut in 1958.

He was born in Spring Gulley, SC, USA, and raised in South Philadelphia, Pennsylvania, and attended South Philadelphia High School with Frankie Avalon and Fabian. <a href=""https://www.last.fm/music/Chubby+Checker"">Read more on Last.fm</a>",535123,3004169,"['Bill Haley', 'Bill Haley & His Comets', 'Eddie Cochran', 'Gene Vincent', 'The Swinging Blue Jeans']"
154,Oliver Tree,"OIiver Tree Nickell is an American vocalist, producer, and filmmaker from Santa Cruz, California. He signed to Atlantic Records in 2017, after his song ""When I'm Down"" went viral. He blurs the lines between meme and music with his strange and hilarious online presence. 

The Santa Cruz native is known for his wide-ranging creativity. Even by looking at his social media pages it's apparent that Oliver Tree's 'brand' is composed of equal elements art, humor, and originality. <a href=""https://www.last.fm/music/Oliver+Tree"">Read more on Last.fm</a>",1275834,38654135,"['Whethan', 'BoyWithUke', 'Dayglow', 'Easy Life', 'twenty one pilots']"
155,Loathe,"Loathe are an English alternative metal band from Liverpool, England. Formed in 2014, the group consists of lead vocalist Kadeem France, guitarist and second vocalist Erik Bickerstaffe, drummer Sean Radcliffe and bassist Feisal El-Khazragi. They are signed to SharpTone Records and have released two EPs and three studio albums. Prepare Consume Proceed was released in 2015 and was re-issued in 2016 through SharpTone Records as the label's first release. <a href=""https://www.last.fm/music/Loathe"">Read more on Last.fm</a>",670726,33189505,"['Thornhill', 'Static Dress', 'Invent Animate', 'Fleshwater', 'Moodring']"
156,grandson,"Grandson is an alternative artist hailing from Toronto, Canada. Born in the small town of Englewood New Jersey, he relocated to the cultural melting pot of Toronto at a young age, and grew up surrounded by music ranging from jazz to rock and roll to rap, dancehall and r&b. He began playing guitar and piano in high school.

At 17, he relocated to Montreal, QC to attend university, and began working in nightclubs cleaning tables and DJing. He started writing music at this time, incorporating the unique blend of sounds he grew up surrounded by. <a href=""https://www.last.fm/music/Grandson"">Read more on Last.fm</a>",715458,20897336,[]
157,Wanda Jackson,"Wanda Jackson (born Wanda Lavonne Jackson, October 20, 1937 in Maud, Oklahoma) is an American rock and roll singer. Having made her debut recordings at the age of nineteen, she became one of the first popular female rock and roll singers in history and as a result, a pioneering and influential figure in female musicianship. She is known as the ""Queen (or First Lady) of Rockabilly.""

Jackson was still in high school when country singer Hank Thompson heard her sing on an Oklahoma City radio show and asked her to record with his band in 1954. <a href=""https://www.last.fm/music/Wanda+Jackson"">Read more on Last.fm</a>",445294,4019038,"['Gene Vincent', 'Carl Perkins', 'Eddie Cochran', 'Jerry Lee Lewis', 'Billy Lee Riley']"
158,El Plan De La Mariposa," <a href=""https://www.last.fm/music/El+Plan+De+la+Mariposa"">Read more on Last.fm</a>",12079,267989,"['MUSTAFUNK', 'Bahiano', 'Miguel Abuelo', 'Camionero', 'Resistencia Suburbana']"
159,Luis Alberto Spinetta,"Luis Alberto Spinetta, also known as El Flaco Spinetta (January 23, 1950 -  February 8, 2012), was an Argentine musician. He was one of the most influential rock musicians of Latin America, and together with Charly García is considered the father of Argentinean rock. He was born in Buenos Aires, Argentina, in the residential neighbourhood of Belgrano. Since he was a kid he listened to all kinds of music: folklore and tango, and a little bit later, rock. <a href=""https://www.last.fm/music/Luis+Alberto+Spinetta"">Read more on Last.fm</a>",181066,6681209,"['Spinetta Jade', 'Spinetta y los Socios del Desierto', 'Invisible', 'Charly García', 'Almendra']"
160,Conociendo Rusia,"Conociendo Rusia es un proyecto liderado por Mateo Sujatovich. Desde el primer disco, homónimo, que la intención está clara: refundar la canción clásica argentina. Subido en los hombros de los más grandes, su manera de componer nos regala música

que es familiar y novedosas a la vez.

Una combinación explosiva. En 2019 Mateo vuelve quedar en boca de todos con “La mexicana”, un single que al ritmo de una ranchera rockera aborda el desamor y se sigue acercando al oido popular. <a href=""https://www.last.fm/music/Conociendo+Rusia"">Read more on Last.fm</a>",56900,2054502,"['El Zar', 'El Kuelgue', 'Bandalos Chinos', 'Silvestre y La Naranja', 'Zoe Gotusso']"
161,Awaken I Am,"Awaken I Am is a Progressive Rock/Post-Hardcore band from Gold Coast and Brisbane. You may recognize some of them from the band Sleepers, but after a few line-up changes, the guys decided to start fresh as Awaken I Am. The list of bands who AIA have toured with in the past year also looks remarkably like the roster of Australia's biggest touring acts: The Amity Affliction, Closure In Moscow, As Tall As Lions, Lydia, Dream On Dreamer, Tonight Alive <a href=""https://www.last.fm/music/Awaken+I+Am"">Read more on Last.fm</a>",116187,1789348,"['Nerv', 'Caskets', 'Wind Walkers', 'Slaves', 'Normandie']"
162,Pearl Jam,"Pearl Jam are an American grunge band formed in Seattle, Washington, in 1990. The band's lineup consists of founding members Jeff Ament (bass guitar), Stone Gossard (rhythm guitar), Mike McCready (lead guitar), and Eddie Vedder (lead vocals, guitar), as well as Matt Cameron (drums), who joined in 1998. Keyboardist Boom Gaspar has also been a touring/session member with the band since 2002. Drummers Jack Irons, Dave Krusen, Matt Chamberlain, and Dave Abbruzzese are former members of the band. <a href=""https://www.last.fm/music/Pearl+Jam"">Read more on Last.fm</a>",3864235,210831222,"['Eddie Vedder', 'Temple of the Dog', 'Soundgarden', 'Stone Temple Pilots', 'Chris Cornell']"
163,Yusuf / Cat Stevens,"Yusuf Islam (born Steven Demetre Georgiou, 21 July 1948),[1] best known by his former stage name Cat Stevens, is a British musician. He is a singer-songwriter, multi-instrumentalist, educator, philanthropist and prominent convert to Islam.

His albums Tea for the Tillerman and Teaser and the Firecat were both certified as Triple Platinum by the RIAA in the United States; his album Catch Bull at Four sold half a million copies in the first two weeks of release alone, and was Billboard's number-one LP for three consecutive weeks. <a href=""https://www.last.fm/music/Yusuf+%2F+Cat+Stevens"">Read more on Last.fm</a>",875528,14813175,[]
164,Bunbury," <a href=""https://www.last.fm/music/+noredirect/Bunbury"">Read more on Last.fm</a>",76681,2306443,[]
