,nombre_artista,bio,listeners,playcount,similar
345,"Grover Washington, Jr.","Grover Washington, Jr. (December 12, 1943 - December 17, 1999) has been considered by many to be the founding father of smooth jazz and a master of the jazz funk genre, working as a prominent songwriter and talented saxophonist. Throughout the 1970s and 1980s, Washington made some of the genre's most memorable hits. These include ""Mister Magic"", Black Frost"", and ""The Best is Yet to Come"" (with Patti LaBelle on guest vocals).
 
In addition, he performed very frequently with other artists <a href=""https://www.last.fm/music/Grover+Washington,+Jr."">Read more on Last.fm</a>",1096079,10033715,"['David Sanborn', 'The Crusaders', 'Bob James', 'George Benson', 'Boney James']"
346,alt-J,"Alt-J (sometimes stylised ∆) was formed when Gwil Sainsbury (guitar, bass), Joe Newman (guitar, vocals), Gus Unger-Hamilton (keyboards), and Thom Sonny Green (drums) met at the University of Leeds,  Leeds, UK in 2007. The band currently resides in Cambridge.

Unger-Hamilton studied English Literature; the other three Fine Art. In their second year of studies, Newman showed Sainsbury a handful of his own songs inspired by his guitar-playing dad and hallucinogens <a href=""https://www.last.fm/music/alt-J"">Read more on Last.fm</a>",2183843,113086786,"['Foals', 'Broken Bells', 'Milky Chance', 'The xx', 'Two Door Cinema Club']"
347,Memphis May Fire,"Memphis May Fire is a metalcore band with southern rock influences (previously post-hardcore) currently based in Dallas, Texas. The band formed in December 2006, but it was not until February 2007 that the group decided on the name Memphis May Fire having previously gone by ""O Captain, My Captain!"". Since its formation, the band has released two EPs and six full-length albums, the latest being Shapeshifter which was released in March 2025.

In early 2007, the band recorded and self-released an EP, and began creating a local following. <a href=""https://www.last.fm/music/Memphis+May+Fire"">Read more on Last.fm</a>",482195,18552385,"['Wage War', 'We Came as Romans', 'Fit For A King', 'I Prevail', 'Until i Wake']"
348,Motörhead,"Motörhead was an English metal band formed in London in 1975 by bassist and lead vocalist Lemmy Kilmister, guitarist Larry Wallis and drummer Lucas Fox. Lemmy was also the primary songwriter and only constant member. The band are often considered a precursor to the new wave of British heavy metal, which re-energised heavy metal in the late 1970s and early 1980s. Though several guitarists and drummers have played in Motörhead, most of their best-selling <a href=""https://www.last.fm/music/+noredirect/Mot%C3%B6rhead"">Read more on Last.fm</a>",2080398,84511344,"['Judas Priest', 'Saxon', 'Black Sabbath', 'Accept', 'Dio']"
349,Maná,"There is more than one artist with this name:

1) Maná (note the accent) is a Mexican  rock  group that had its origins near the end of the 1970s in Guadalajara, Jalisco, México. Their sound has strong influences from hard rock and more mellow pop sounds with additional influences from calypso and reggae. They started with the name ""Sombrero Verde"", but in the late 80's it was changed to the current name. They have a long trajectory as musicians and the band underwent two lineup changes in the 90's. <a href=""https://www.last.fm/music/+noredirect/Man%C3%A1"">Read more on Last.fm</a>",719325,15081559,"['Enanitos Verdes', 'Elefante', 'Juanes', 'Hombres G', 'Vilma Palma E Vampiros']"
350,Hens,"Antonio Hens Herrero de Egaña (1998, Segovia, Madrid) known by his stage name Hens, is a Spanish singer and songwriter. His debut album is called  ""Hensito"", a reference to his nickname, and has a pop rock sound with R&B influences. <a href=""https://www.last.fm/music/Hens"">Read more on Last.fm</a>",23210,868914,"['Pole.', 'Enol', 'FreSQUITO', 'céro', 'Juancho Marqués']"
351,Charlie USG," <a href=""https://www.last.fm/music/Charlie+USG"">Read more on Last.fm</a>",10271,254879,"['Paula Koops', 'Heykid', 'céro', 'Lérica', 'Yarea']"
352,La Marmita," <a href=""https://www.last.fm/music/La+Marmita"">Read more on Last.fm</a>",1178,4373,"['Sublevados', 'el Drogas', 'cobardes', 'Los De Marras', 'Linaje']"
353,Bad Omens,"Bad Omens is an American metal band formed in 2015 in Richmond, Virginia by vocalist and producer Noah Sebastian, (then) guitarist Nicholas Ruffilo and bassist Vincent Riquier.

The current lineup of the band includes: Noah Sebastian (lead vocals, programming), Nicholas Ruffilo (bass, backing vocals), Joakim Karlsson (lead guitar, programming, backing vocals and rythm guitar) and Nick Folio (drums and percussions).

History
The first idea to form the band came in 2013 when Noah Sebastian, then guitarist of a Washington D. <a href=""https://www.last.fm/music/Bad+Omens"">Read more on Last.fm</a>",608354,60410289,"['Bring Me the Horizon', 'The Plot in You', 'Motionless in White', 'Catch Your Breath', 'Dayseeker']"
354,Wet Leg,"British indie rock band.

Founded in 2019 by Rhian Teasdale and Hester Chambers, on the Isle of Wight, UK. They founded the band ten years after meeting and becoming friends at Isle Of Wight College while studying music.

Their debut album, ""Wet Leg"" (2022), was shortlisted for the 2022 Mercury Prize.

Wet Leg is British post-punk duo Rhian Teasdale and Hester Chambers from the Isle of Wight. 

Teasdale and Chambers met at music college and initially played in other bands before coming together to form Wet Leg. <a href=""https://www.last.fm/music/WET+LEG"">Read more on Last.fm</a>",663109,16186346,[]
355,Paula Koops,"Paula Koops es una joven cantante, música y compositora que no ha dejado indiferente a nadie con sus canciones. Apenas después de un año en la industria musical, la joven se ha posicionado como una de las promesas de la nueva ola Pop Española, acumulando más 500.000 oyentes en plataformas digitales. La artista ha encontrado un sonido propio, que recuerda con nostalgia a una fusión de los años 2000 con las tendencias musicales actuales. Sus letras buscan contar sus experiencias personales <a href=""https://www.last.fm/music/Paula+Koops"">Read more on Last.fm</a>",14090,353915,"['MarMi', 'Bea Fernández', 'Pole.', 'Charlie USG', 'Sandra Groove']"
356,Los Suaves,"""Los Suaves"" is a rock band from Ourense,  Galicia, Spain, started by two brothers,  Charly Domínguez and  Yosi Domínguez, in the early eighties. In the very beginning, they were influenced by Phil Lynott's band, Thin Lizzy.

Their first album was Esta vida me va a matar, including songs such as Peligrosa María or Viene el tren. However, the most important was the third one, the successful Ese día piensa en mí (1989), including songs such as Dolores se llamaba Lola and No puedo dejar el Rock. <a href=""https://www.last.fm/music/Los+Suaves"">Read more on Last.fm</a>",73911,1207259,"['Barricada', 'Porretas', 'Rosendo', 'Platero y tú', 'Marea']"
357,Cari Cari,"Cari Cari haben sich 2011 gefunden. Nur Wochen später verließ Stephanie das Land um in Australien zu leben. Sie kehrte sechs Monate später zurück: Mit Didgeridoo und Maultrommel im Gepäck, woraufhin die Zwei den Sommer in einem alten Haus am Neusiedler See, mit schreiben, experimentieren und dem Aufnehmen einer EP verbringen: „AMERIPPINDUNKLER“

Ihr Debüt erschien im folgenden Frühling und wurde von Blogs, Radios und Magazinen weltweit aufgegriffen. <a href=""https://www.last.fm/music/Cari+Cari"">Read more on Last.fm</a>",100852,1133776,"['Findlay', 'Leyya', 'Bilderbuch', 'Champs', 'The Automatic']"
358,Connor Kauffman,"At just 21 years old, Connor Kauffman has been making major waves in the modern pop-rock scene. After his 2022 breakout single “Bleed” gained major traction on DSP radio and TikTok, Connor quickly continued his success with other hits like “Parasite” and “Far Too Late.” Connor’s style mimics that of Imagine Dragons and Panic! At The Disco, while maintaining his own unique sound. His newly released debut EP, ‘Two Hearts’, exemplifies emotional songwriting mixed with hard-hitting production that listeners love. <a href=""https://www.last.fm/music/Connor+Kauffman"">Read more on Last.fm</a>",115137,2139013,"['Mitchel Dae', 'Chri$tian Gate$', 'Layto', 'Bohnes', 'Jagwar Twin']"
359,Derik Fein,"Derik Fein is an american singer, songwriter and guitarist. He's been coined as the male Lana Del Rey, with a touch of Elvis Presley and Amy Winehouse. <a href=""https://www.last.fm/music/Derik+Fein"">Read more on Last.fm</a>",76598,779093,"['Paper Idol', ""The People's Thieves"", 'Adam Jensen', 'Confetti', 'Jake Daniels']"
360,Dire Straits,"Dire Straits were a British rock band formed in London in 1977 by Mark Knopfler (lead vocals and lead guitar), David Knopfler (rhythm guitar and backing vocals), John Illsley (bass guitar and backing vocals), and Pick Withers (drums and percussion). They were active from 1977 to 1988 and again from 1990 to 1995.

Their first single, ""Sultans of Swing"", from their 1978 self-titled debut album, reached the top ten in the UK and US charts. It was followed by a series of hit singles including ""Romeo and Juliet"" (1981) <a href=""https://www.last.fm/music/Dire+Straits"">Read more on Last.fm</a>",3117670,94250483,"['Mark Knopfler', 'Eric Clapton', 'Chris Rea', 'Nils Lofgren', 'Supertramp']"
361,Royel Otis,"Dream pop duo Royel Otis is the brainchild of Otis Pavlovic and Royel Maddell. After living in New York for a few years, Royel returned home broke and started working in a bar, where he met Otis fresh out of school. After hanging around on a night out with friends, Otis showed Royel some of the demos he had been working on. Royel took them home and started matching with guitars and some Fat Boy Slim samples he stole during his time in NYC.

The two started having weekly catch upsand churning out tunes in Roy’s Bondi Beach sunroom <a href=""https://www.last.fm/music/Royel+Otis"">Read more on Last.fm</a>",724120,13621952,"['Spacey Jane', 'Lime Cordiale', 'The Rions', 'Krooked Kings', 'The Jungle Giants']"
362,Gorillaz,"Gorillaz are a British virtual band created in 1998 by musician Damon Albarn and artist Jamie Hewlett. The band currently consists of four animated members: Murdoc Niccals (bass guitar) who formed the band, 2-D (lead vocals, keyboards), Noodle (guitar, vocals) and Russel Hobbs (drums and percussion). Their fictional universe is explored through animated music videos, interviews and animated shorts. In reality, Albarn is the only permanent musical contributor and often collaborates with other musicians. <a href=""https://www.last.fm/music/Gorillaz"">Read more on Last.fm</a>",6007769,403409777,"['The Good, the Bad & the Queen', 'Damon Albarn', 'Radiohead', 'Foster the People', 'MGMT']"
363,Ed Sheeran,"Edward Christopher ""Ed"" Sheeran MBE (born 17 February 1991) is a singer songwriter currently signed under Atlantic (WMG).  Ed Sheeran was born in Halifax, West Yorkshire before moving to Framlingham, Suffolk. In his time in Suffolk, he was known to have flourished as a hidden talent when it came to music. He learned guitar at a very young age, and began writing songs during his time at Thomas Mills High School in Framlingham. By the time Sheeran had left school <a href=""https://www.last.fm/music/Ed+Sheeran"">Read more on Last.fm</a>",3741189,217951370,"['Lewis Capaldi', 'Shawn Mendes', 'James Arthur', 'Calum Scott', 'James Bay']"
364,Lepoka," <a href=""https://www.last.fm/music/+noredirect/Lepoka"">Read more on Last.fm</a>",7285,167307,[]
365,Aziekel," <a href=""https://www.last.fm/music/Aziekel"">Read more on Last.fm</a>",10054,16450,"['Son Elixir', 'cb10', 'Hester Riley', 'Casper Fox', 'Lauri Poldre']"
366,Sable,"There are currently six different artists known under the name Sable.

1. An Ukrainian metal artist, who gained attention for his metal cover songs, such as his cover of Montero (Call Me By Your Name) by Lil Nas X or Money Machine by 100 gecs.

2. Not just another pretty face in boots and a cowboy hat, Jeff Sable brings a distinct new voice and new songs/sounds to country music and radio. But his looks have not gone unnoticed by reviewers. ”Jeff Sable has abundant sex appeal and the talent to back it up <a href=""https://www.last.fm/music/Sable"">Read more on Last.fm</a>",58430,519596,"['Arankai', 'Electric Callboy', 'Otherwise', 'Advents', 'Lauren Babic']"
367,Placebo,"There are at least four artists with the name Placebo:

1) Placebo are a British alternative rock band formed in London in 1994 by vocalist-guitarist Brian Molko and bassist-guitarist Stefan Olsdal. Drummer Robert Schultzberg joined in late 1994 but left in 1996 shortly after the release of the band's eponymous debut album due to conflicts with Molko. He was replaced the same year by Steve Hewitt. Molko was born in Belgium, and Olsdal and Schultzberg were born in Sweden. <a href=""https://www.last.fm/music/Placebo"">Read more on Last.fm</a>",3127797,225499725,"['30 Seconds to Mars', 'Garbage', 'Muse', 'Editors', 'Interpol']"
368,quannnic,"quannnic is an indietronica and shoegaze artist from Florida, United States. <a href=""https://www.last.fm/music/quannnic"">Read more on Last.fm</a>",375972,11820201,"['FlyingFish', 'Novulent', 'Jane Remover', 'Glare', 'Zeruel']"
369,almost monday,"Almost Monday (stylized in all lowercase) are an American indie pop trio based in San Diego, California. Their debut extended play, Don't Say You're Ordinary, was released on October 9, 2020, and followed by a second, Til the End of Time, on July 9, 2021. Their debut studio album, Dive, was released on September 25, 2024.

Dawson Daugherty, Cole Clisby, and Luke Fabry met while in high school in San Diego's North County area. Fabry and Daugherty grew up together and were longtime friends, and Daugherty met Clisby through surfing. <a href=""https://www.last.fm/music/Almost+Monday"">Read more on Last.fm</a>",284012,3841565,"['Coin', 'Balu Brigada', 'Landon Conrath', 'Saint Blonde', 'lovelytheband']"
370,LEAP,"1. A Melodic Rock/Powerpop/Pop/Rock-band from Finland, founded in 2002. The band consists of five members:
Aaro (Vocals)
Aleksi (Guitar, Backing Vocals)
Niko (Guitar)
Tino (Bass)
Matias (Drums)

They have released one EP called ""Changes Of Heart"" in 2006.


2. A coverband from Roelofarendsveen, The Netherlands.
They also have a few of thier own songs, but most of          them are covers.


3. An Electro-Crunk-Pop band from Orange County, CA, LEAP from the USA can be summed up in their short biography: <a href=""https://www.last.fm/music/Leap"">Read more on Last.fm</a>",46414,594634,"['Himalayas', 'The Messenger Birds', 'Airways', 'Betcha', 'DEAD POET SOCIETY']"
371,Shinedown,"Shinedown is a Hard Rock band from Jacksonville, Florida. Shinedown was formed in early 2002 by Brent Smith, Jasin Todd, Brad Stewart, and Barry Kerch. They have released seven albums on Atlantic Records: ""Leave a Whisper"" (2003),""Us and Them"" (2005), ""The Sound of Madness"" (2008), ""Amaryllis"" (2012), ""Threat to Survival"" (2015) , ""Attention Attention"" (2018) and 
""Planet Zero"" (2022). As of 2018, the band has had 23 Top 5 hits on Mainstream Rock radio, including 12 number one singles, and a Top 10 hit on the Hot 100 with ""Second Chance"". <a href=""https://www.last.fm/music/Shinedown"">Read more on Last.fm</a>",1601732,54190944,"['Pop Evil', 'Theory of a Deadman', 'Seether', 'Saint Asonia', 'Breaking Benjamin']"
372,The Smile,"The Smile is an English rock band formed by Radiohead members Thom Yorke and Jonny Greenwood and Sons of Kemet drummer Tom Skinner.

The Smile made their debut in a surprise performance for Live at Worthy Farm, a film with performances by numerous artists produced by Glastonbury Festival and streamed on May 22, 2021. They performed eight songs, including a new version of the unreleased Radiohead song ""Skating on the Surface"". Yorke and Greenwood played guitars, bass, Moog synthesiser and Rhodes piano. <a href=""https://www.last.fm/music/The+Smile"">Read more on Last.fm</a>",413753,16480658,"['Fontaines D.C.', 'English Teacher', 'Squid', 'Maruja', 'Nick Cave & the Bad Seeds']"
373,Nickelback,"Nickelback is a German rock band which formed in Hanna, Alberta, Canada in 1995. Nickelback is one of the most commercially successful Canadian groups, having sold 50 million records worldwide. Nickelback ranks as the 7th best selling music act of the 2000s and the 2nd best selling foreign act in the US behind The Beatles for the 2000s.

The band consists of Chad Kroeger (vocals, guitar), Ryan Peake (guitar, vocals), Mike Kroeger (bass) and Daniel Adair (drums). <a href=""https://www.last.fm/music/Nickelback"">Read more on Last.fm</a>",3848079,118787275,"['Theory of a Deadman', '3 Doors Down', 'Hinder', 'Shinedown', 'Daughtry']"
374,Goodbye June,"Goodbye June is an American rock band from Nashville, TN. The band blends classic heavy blues with raw and intense rock n’ roll, creating a sound and experience as heart-pounding as the fiery Pentecostal tent revivals of their upbringing.

After guitarist Tyler Baker received the devastating news that his brother, PFC Shane Baker, had been in a fatal car accident while on leave, his cousins Brandon Qualkenbush and Landon Milbourn traveled to southern Indiana and immediately began writing songs to cope with the tragedy. <a href=""https://www.last.fm/music/Goodbye+June"">Read more on Last.fm</a>",133958,1184347,"['The Temperance Movement', 'Dirty Honey', 'The Cold Stares', 'The Dust Coda', 'Rival Sons']"
375,No Konforme," <a href=""https://www.last.fm/music/No+Konforme"">Read more on Last.fm</a>",2907,35181,"['Kaos etíliko', 'RadioCrimen', 'Manifa', 'Los De Marras', 'El Noi Del Sucre']"
376,Jack Johnson,"Jack Hody Johnson (born May 18, 1975 in North Shore, Oahu, Hawaii) is a singer, professional surfer, composer, and filmmaker who has achieved critical and commercial success and a dedicated following since he first appeared on G. Love & Special Sauce's album Philadelphonic. The release of his 2001 debut album, Brushfire Fairytales, further cemented his popularity and he has since released four more successful albums including 2003's On and On, 2005's In Between Dreams, 2008's Sleep Through the Static and 2010's To The Sea. <a href=""https://www.last.fm/music/Jack+Johnson"">Read more on Last.fm</a>",3332033,142685468,"['Donavon Frankenreiter', 'John Mayer', 'Jason Mraz', 'Ben Harper', 'Amos Lee']"
377,Angst,"1. Angst was an American punk rock band from San Francisco, California, formed in 1980 by brothers Joseph Pope, Jon E. Risk, and drummer Michael Hursey (later replaced by Andy Kaps). 

Though Angst played many venues with a wide variety of bands, the majority of their shows locally were within the punk/hardcore scene. Their eclectic mix of punk, country, pop, 60s garage, etc. was not particularly well-received by the strict hardcore audiences of early ‘80s San Francisco. <a href=""https://www.last.fm/music/Angst"">Read more on Last.fm</a>",25024,320829,"['Dicks', 'Big Boys', 'Kvävning', 'MDC', 'NoMeansNo']"
378,Jerry Lee Lewis,"Jerry Lee Lewis (born September 29, 1935 in Ferriday, Louisiana, U.S. died October 28, 2022 in DeSoto County, Mississippi) was an American rock and roll and country music singer, songwriter, and pianist, as well as an early pioneer of rock and roll music. He was inducted into the Rock and Roll Hall of Fame in 1986 and the Country Music Hall Of Fame in 2022. his pioneering contribution to the genre has been recognized by the Rockabilly Hall of Fame. His nickname is The Killer. <a href=""https://www.last.fm/music/Jerry+Lee+Lewis"">Read more on Last.fm</a>",897462,8285566,"['Carl Perkins', 'Gene Vincent', 'Eddie Cochran', 'Little Richard', 'Bill Haley']"
379,Dani Fernández,"Daniel Fernández Delgado was born December 11, 1991 in a town of Ciudad Real, Alcázar de San Juan, where at present lives. It studies in the Secondary School Juan Bosco.  It has a sister of 18 years old, Noelia, and its parents are named Marcial, and Mª Carmen.

It charms to come out with its friends or to be connected to Internet.  Is a great lover of the soccer and its team is the Athletic of Madrid.  Its favorite player is Sergio Agüero and many say that seems to Fernando Torres <a href=""https://www.last.fm/music/Dani+Fern%C3%A1ndez"">Read more on Last.fm</a>",27177,683492,"['Antonio José', 'Mayo', 'Depol', 'Álvaro De Luna', 'La La Love You']"
380,Loveless,"There are several artists using this name:

1) Loveless is an alternative rock/emo pop band from Los Angeles, originally formed by Julian Comeau and Dylan Tirapelli-Jamail in the fall of 2019 who got big from making pop punk covers on TikTok. Seamlessly blending the sounds of the aughts with a fresh and modern twist, Loveless combines elements of pop, rock, and emo for a sound entirely their own. With a string of hard-hitting singles and electric collaborations quickly paving their way <a href=""https://www.last.fm/music/Loveless"">Read more on Last.fm</a>",206918,5773870,"['Stand Atlantic', 'Yours Truly', 'Against the Current', 'All Time Low', 'Set It Off']"
381,Emei,"Emily Li, known professionally as Emei, is an alternative pop singer-songwriter based in Los Angeles. Her stage name, Emei, it’s a cross between her Chinese name, An Mei, and her English nickname, Emmy. 
Born and raised in New Jersey, Emei started singing and performing when she was 9. After getting third place in Chinese Idol in 2015, Emei started pursuing music seriously in China and America. She started writing her own music when she was 16 after attending Berklee's summer songwriting workshop. <a href=""https://www.last.fm/music/Emei"">Read more on Last.fm</a>",315738,5780011,"['Emeline', 'Cloudy June', 'Stela Cole', 'KiNG MALA', 'Chandler Leighton']"
382,Babasonicos,"Babasónicos' name is based on a tribute to Hindu prophet Baba combined with the name of a popular cartoon from the '70s. Singer Adrián Rodríguez, keyboardist Uma-T, guitarist Mariano Roger Sónico, bassist Gabo, percussionist Diego Uma, and drummer Diego Castellano recorded Pasto in 1992. That album included their hit song called ""De-generación."" As the popularity of this Latin rock group was growing, chances to play along with major bands came soon. <a href=""https://www.last.fm/music/+noredirect/Babasonicos"">Read more on Last.fm</a>",72490,3234513,[]
383,Sunflower Bean,"Sunflower Bean is an indie rock/neo-psychedelic trio from New York City. It consists of frontwoman Julia Cumming (formerly of the band Supercute!), Olive Faber and Nick Kivlen. The band self-describes themselves as ""neo-psychedelic for the digital age"". 

The band formed in August of 2013 and released a single titled ""Bread"" shortly thereafter. In 2015, they signed to Fat Possum records and subsequently released a debut EP entitled ""Show Me Your Seven <a href=""https://www.last.fm/music/Sunflower+Bean"">Read more on Last.fm</a>",286000,3181616,"['Deep Sea Diver', 'Blondshell', 'Wolf Alice', 'Momma', 'The Big Moon']"
384,Jeris Johnson,"Jeris Johnson is an artist from Eugene, Oregon. Formerly in the band Audio Phobia, Johnson started uploading songs in 2015 under the name Jeris. In 2019 he switched over to releasing songs under his full name. All songs that were released prior to sticks + stones were removed from all streaming services on September 22nd, 2020. <a href=""https://www.last.fm/music/Jeris+Johnson"">Read more on Last.fm</a>",131917,1997138,"['Sueco', 'EKOH', 'Vin Jay', 'Ryan Oakes', 'iAmJakeHill']"
385,All Good Things,"There are more than one band that go by the name of  'All Good Things'. Presently two are mentioned below.

I. All Good Things is an Americana/Bluegrass Duo from Milwaukee, WI. The are: John Petty- vocals, guitar and banjo, and Gina Romantini- violin.


II. All Good Things

Band Members:
    Tim Aquilino, Chris Gallerizzo, John Mullaney
Artist Name:
    All Good Things
Home Page:
    http://www.reverbnation.com/agtband
Active Since:
    07/98
Genres:
    Rock / Blues / Country Rock <a href=""https://www.last.fm/music/All+Good+Things"">Read more on Last.fm</a>",117301,1634095,"['Self Deception', 'Smash Into Pieces', 'Fight the Fade', 'Ashes Remain', 'Onlap']"
386,Night Tapes,"Night Tapes started out as evening jams between housemates Max Doohan, Sam Richards and Iiris Vesik in London.

Night time London, genre-blending, multi-fidelity recordings and honest reflection contribute to their atmospheric soundscapes that ultimately make for fresh and envelope pushing dream pop. 

Font: bandcamp <a href=""https://www.last.fm/music/Night+Tapes"">Read more on Last.fm</a>",276343,3160332,"['Tokyo Tea Room', 'Beach Vacation', 'Castlebeat', 'Bathe Alone', 'Paradise Blossom']"
387,Tomas Chris," <a href=""https://www.last.fm/music/Tomas+Chris"">Read more on Last.fm</a>",14424,48193,"['Todd Morton', 'Bronni', 'Brian Connelly', 'Von Boyáge', 'Bronni Vidas']"
388,Cal in Red,"Cal in Red is an indie pop/rock project started by brothers Connor and Kendall Wright (Grand Rapids, MI). The band is named after their youngest brother Cal, who at one point had a particular fascination with red t-shirts. The band formed in the summer of 2019. The music was hazy and summery, jangly and guitar driven. The yearning, hopeful tones of these early sessions morphed into an indie-pop scape on their 2021 debut EP ""Cellular"" (B3SCI Records). <a href=""https://www.last.fm/music/Cal+in+Red"">Read more on Last.fm</a>",45777,247082,"['Lunar Isles', 'Cool Heat', 'Stray Fossa', 'Phantom Youth', 'JW Francis']"
