,nombre_artista,bio,listeners,playcount,similar
349,Red Hot Chili Peppers,"Red Hot Chili Peppers are an American alternative rock band formed in Los Angeles in 1982. Their music incorporates elements of alternative rock, funk, punk rock and psychedelic rock. The band consists of co-founders Anthony Kiedis (lead vocals) and Flea (bass), as well as drummer Chad Smith, and guitarist John Frusciante, the latter of whom has been in the band across three stints. With over 100 million records sold worldwide, Red Hot Chili Peppers is one of the best-selling bands of all time. <a href=""https://www.last.fm/music/Red+Hot+Chili+Peppers"">Read more on Last.fm</a>",6492657,457077894,"['John Frusciante', 'Foo Fighters', 'Audioslave', 'Ataxia', 'Incubus']"
350,Charlie USG," <a href=""https://www.last.fm/music/Charlie+USG"">Read more on Last.fm</a>",10234,253844,"['Heykid', 'céro', 'Lérica', 'Yarea', 'David Otero']"
351,Hens,"Antonio Hens Herrero de Egaña (1998, Segovia, Madrid) known by his stage name Hens, is a Spanish singer and songwriter. His debut album is called  ""Hensito"", a reference to his nickname, and has a pop rock sound with R&B influences. <a href=""https://www.last.fm/music/Hens"">Read more on Last.fm</a>",23178,867102,"['Pole.', 'Enol', 'FreSQUITO', 'céro', 'Juancho Marqués']"
352,Maná,"There is more than one artist with this name:

1) Maná (note the accent) is a Mexican  rock  group that had its origins near the end of the 1970s in Guadalajara, Jalisco, México. Their sound has strong influences from hard rock and more mellow pop sounds with additional influences from calypso and reggae. They started with the name ""Sombrero Verde"", but in the late 80's it was changed to the current name. They have a long trajectory as musicians and the band underwent two lineup changes in the 90's. <a href=""https://www.last.fm/music/+noredirect/Man%C3%A1"">Read more on Last.fm</a>",717532,15032441,"['Enanitos Verdes', 'Elefante', 'Juanes', 'Hombres G', 'Vilma Palma E Vampiros']"
353,"Grover Washington, Jr.","Grover Washington, Jr. (December 12, 1943 - December 17, 1999) has been considered by many to be the founding father of smooth jazz and a master of the jazz funk genre, working as a prominent songwriter and talented saxophonist. Throughout the 1970s and 1980s, Washington made some of the genre's most memorable hits. These include ""Mister Magic"", Black Frost"", and ""The Best is Yet to Come"" (with Patti LaBelle on guest vocals).
 
In addition, he performed very frequently with other artists <a href=""https://www.last.fm/music/Grover+Washington,+Jr."">Read more on Last.fm</a>",1094261,10013298,"['David Sanborn', 'The Crusaders', 'Bob James', 'George Benson', 'Boney James']"
354,Memphis May Fire,"Memphis May Fire is a metalcore band with southern rock influences (previously post-hardcore) currently based in Dallas, Texas. The band formed in December 2006, but it was not until February 2007 that the group decided on the name Memphis May Fire having previously gone by ""O Captain, My Captain!"". Since its formation, the band has released two EPs and six full-length albums, the latest being Shapeshifter which was released in March 2025.

In early 2007, the band recorded and self-released an EP, and began creating a local following. <a href=""https://www.last.fm/music/Memphis+May+Fire"">Read more on Last.fm</a>",481527,18522641,"['Wage War', 'We Came as Romans', 'Fit For A King', 'I Prevail', 'Until i Wake']"
355,Motörhead,"Motörhead was an English metal band formed in London in 1975 by bassist and lead vocalist Lemmy Kilmister, guitarist Larry Wallis and drummer Lucas Fox. Lemmy was also the primary songwriter and only constant member. The band are often considered a precursor to the new wave of British heavy metal, which re-energised heavy metal in the late 1970s and early 1980s. Though several guitarists and drummers have played in Motörhead, most of their best-selling <a href=""https://www.last.fm/music/+noredirect/Mot%C3%B6rhead"">Read more on Last.fm</a>",2078636,84440241,"['Judas Priest', 'Saxon', 'Black Sabbath', 'Accept', 'Dio']"
356,Wet Leg,"British indie rock band.

Founded in 2019 by Rhian Teasdale and Hester Chambers, on the Isle of Wight, UK. They founded the band ten years after meeting and becoming friends at Isle Of Wight College while studying music.

Their debut album, ""Wet Leg"" (2022), was shortlisted for the 2022 Mercury Prize.

Wet Leg is British post-punk duo Rhian Teasdale and Hester Chambers from the Isle of Wight. 

Teasdale and Chambers met at music college and initially played in other bands before coming together to form Wet Leg. <a href=""https://www.last.fm/music/WET+LEG"">Read more on Last.fm</a>",659404,16077337,[]
357,Paula Koops,"Paula Koops es una joven cantante, música y compositora que no ha dejado indiferente a nadie con sus canciones. Apenas después de un año en la industria musical, la joven se ha posicionado como una de las promesas de la nueva ola Pop Española, acumulando más 500.000 oyentes en plataformas digitales. La artista ha encontrado un sonido propio, que recuerda con nostalgia a una fusión de los años 2000 con las tendencias musicales actuales. Sus letras buscan contar sus experiencias personales <a href=""https://www.last.fm/music/Paula+Koops"">Read more on Last.fm</a>",14064,352451,"['Aitana', 'Samuraï', 'Belén Aguilera', 'Ana Mena', 'Luna Ki']"
358,Connor Kauffman,"At just 21 years old, Connor Kauffman has been making major waves in the modern pop-rock scene. After his 2022 breakout single “Bleed” gained major traction on DSP radio and TikTok, Connor quickly continued his success with other hits like “Parasite” and “Far Too Late.” Connor’s style mimics that of Imagine Dragons and Panic! At The Disco, while maintaining his own unique sound. His newly released debut EP, ‘Two Hearts’, exemplifies emotional songwriting mixed with hard-hitting production that listeners love. <a href=""https://www.last.fm/music/Connor+Kauffman"">Read more on Last.fm</a>",114489,2099273,"['Mitchel Dae', 'Chri$tian Gate$', 'Layto', 'Bohnes', 'Jagwar Twin']"
359,Marea,"Marea is an Spanish rock 'n' roll band formed in Berriozar, Navarra in 1998. 
The members of the band are Kutxi Romero as vocalist, Alen Ayerdi as drummer, César Ramallo on rhytmical guitar, David Díaz (Kolibri) as leading guitar and Eduardo Beaumont (Piñas) as bassist and vocalist.
Marea has recorded five albums since its formation: La Patera (1999), Revolcón (2000), Besos De Perro (2002), 28000 Puñaladas (2004) and Las Aceras Están Llenas De Piojos (2007). <a href=""https://www.last.fm/music/Marea"">Read more on Last.fm</a>",113256,4296742,"['La Fuga', 'Extremoduro', 'Platero y tú', 'Barricada', 'Los Suaves']"
360,Los Suaves,"""Los Suaves"" is a rock band from Ourense,  Galicia, Spain, started by two brothers,  Charly Domínguez and  Yosi Domínguez, in the early eighties. In the very beginning, they were influenced by Phil Lynott's band, Thin Lizzy.

Their first album was Esta vida me va a matar, including songs such as Peligrosa María or Viene el tren. However, the most important was the third one, the successful Ese día piensa en mí (1989), including songs such as Dolores se llamaba Lola and No puedo dejar el Rock. <a href=""https://www.last.fm/music/Los+Suaves"">Read more on Last.fm</a>",73885,1206851,"['Barricada', 'Rosendo', 'Porretas', 'Marea', 'Platero y tú']"
361,Despistaos,"La trayectoria de Despistaos está siendo meteórica, con paso firme y gran profesionalidad. En su quinto año de vida, la banda nos presentará en octubre su doble álbum recopilatorio ""Lo que hemos vivido"". 

Durante este verano, Despistaos se han vuelto a meter en el estudio para grabar varias canciones y versionear algunos de sus temas más conocidos, con colaboraciones de lujo como Dani de El Canto del Loco en ""Hasta que pase la tormenta"", Iker de Dikers en ""Nada de que hablar"" y Brigi de Koma en ""El único espectador"".  <a href=""https://www.last.fm/music/Despistaos"">Read more on Last.fm</a>",84364,1553576,"['Maldita Nerea', 'El Canto del Loco', 'Pereza', 'La La Love You', 'Pignoise']"
362,Bad Omens,"Bad Omens is an American metal band formed in 2015 in Richmond, Virginia by vocalist and producer Noah Sebastian, (then) guitarist Nicholas Ruffilo and bassist Vincent Riquier.

The current lineup of the band includes: Noah Sebastian (lead vocals, programming), Nicholas Ruffilo (bass, backing vocals), Joakim Karlsson (lead guitar, programming, backing vocals and rythm guitar) and Nick Folio (drums and percussions).

History
The first idea to form the band came in 2013 when Noah Sebastian, then guitarist of a Washington D. <a href=""https://www.last.fm/music/Bad+Omens"">Read more on Last.fm</a>",605170,60148777,"['Bring Me the Horizon', 'The Plot in You', 'Motionless in White', 'Catch Your Breath', 'Dayseeker']"
363,Dani Fernández,"Daniel Fernández Delgado was born December 11, 1991 in a town of Ciudad Real, Alcázar de San Juan, where at present lives. It studies in the Secondary School Juan Bosco.  It has a sister of 18 years old, Noelia, and its parents are named Marcial, and Mª Carmen.

It charms to come out with its friends or to be connected to Internet.  Is a great lover of the soccer and its team is the Athletic of Madrid.  Its favorite player is Sergio Agüero and many say that seems to Fernando Torres <a href=""https://www.last.fm/music/Dani+Fern%C3%A1ndez"">Read more on Last.fm</a>",27103,680142,"['Antonio José', 'Mayo', 'Depol', 'Álvaro De Luna', 'La La Love You']"
364,Royel Otis,"Dream pop duo Royel Otis is the brainchild of Otis Pavlovic and Royel Maddell. After living in New York for a few years, Royel returned home broke and started working in a bar, where he met Otis fresh out of school. After hanging around on a night out with friends, Otis showed Royel some of the demos he had been working on. Royel took them home and started matching with guitars and some Fat Boy Slim samples he stole during his time in NYC.

The two started having weekly catch upsand churning out tunes in Roy’s Bondi Beach sunroom <a href=""https://www.last.fm/music/Royel+Otis"">Read more on Last.fm</a>",719095,13465052,"['Spacey Jane', 'Lime Cordiale', 'The Rions', 'Krooked Kings', 'The Jungle Giants']"
365,Dire Straits,"Dire Straits were a British rock band formed in London in 1977 by Mark Knopfler (lead vocals and lead guitar), David Knopfler (rhythm guitar and backing vocals), John Illsley (bass guitar and backing vocals), and Pick Withers (drums and percussion). They were active from 1977 to 1988 and again from 1990 to 1995.

Their first single, ""Sultans of Swing"", from their 1978 self-titled debut album, reached the top ten in the UK and US charts. It was followed by a series of hit singles including ""Romeo and Juliet"" (1981) <a href=""https://www.last.fm/music/Dire+Straits"">Read more on Last.fm</a>",3113422,94052546,"['Mark Knopfler', 'Eric Clapton', 'Chris Rea', 'Nils Lofgren', 'Supertramp']"
366,Gorillaz,"Gorillaz are a British virtual band created in 1998 by musician Damon Albarn and artist Jamie Hewlett. The band currently consists of four animated members: Murdoc Niccals (bass guitar) who formed the band, 2-D (lead vocals, keyboards), Noodle (guitar, vocals) and Russel Hobbs (drums and percussion). Their fictional universe is explored through animated music videos, interviews and animated shorts. In reality, Albarn is the only permanent musical contributor and often collaborates with other musicians. <a href=""https://www.last.fm/music/Gorillaz"">Read more on Last.fm</a>",6001382,402636214,"['The Good, the Bad & the Queen', 'Damon Albarn', 'Radiohead', 'MGMT', 'Foster the People']"
367,Shinedown,"Shinedown is a Hard Rock band from Jacksonville, Florida. Shinedown was formed in early 2002 by Brent Smith, Jasin Todd, Brad Stewart, and Barry Kerch. They have released seven albums on Atlantic Records: ""Leave a Whisper"" (2003),""Us and Them"" (2005), ""The Sound of Madness"" (2008), ""Amaryllis"" (2012), ""Threat to Survival"" (2015) , ""Attention Attention"" (2018) and 
""Planet Zero"" (2022). As of 2018, the band has had 23 Top 5 hits on Mainstream Rock radio, including 12 number one singles, and a Top 10 hit on the Hot 100 with ""Second Chance"". <a href=""https://www.last.fm/music/Shinedown"">Read more on Last.fm</a>",1600263,54116374,"['Theory of a Deadman', 'Pop Evil', 'Seether', 'Saint Asonia', 'Hinder']"
368,Ed Sheeran,"Edward Christopher ""Ed"" Sheeran MBE (born 17 February 1991) is a singer songwriter currently signed under Atlantic (WMG).  Ed Sheeran was born in Halifax, West Yorkshire before moving to Framlingham, Suffolk. In his time in Suffolk, he was known to have flourished as a hidden talent when it came to music. He learned guitar at a very young age, and began writing songs during his time at Thomas Mills High School in Framlingham. By the time Sheeran had left school <a href=""https://www.last.fm/music/Ed+Sheeran"">Read more on Last.fm</a>",3734795,217515491,"['Lewis Capaldi', 'Shawn Mendes', 'James Arthur', 'James Bay', 'Calum Scott']"
369,"Black Country, New Road","Black Country, New Road (commonly abbreviated to BCNR or BC,NR) is an English  experimental rock band formed in Cambridgeshire, United Kingdom in 2018, consisting of Tyler Hyde (bass, vocals), May Kershaw (keyboard, accordion, vocals), Georgia Ellery (violin, vocals), Lewis Evans (saxophone, flute, vocals), Charlie Wayne (drums, backing vocals), and Luke Mark (guitar, backing vocals). The band's first two albums featured lead vocalist Isaac Wood, who left the band in 2022. <a href=""https://www.last.fm/music/Black+Country,+New+Road"">Read more on Last.fm</a>",641881,52929667,"['black midi', 'Squid', 'The Orchestra (For Now)', 'Maruja', 'Ugly (UK)']"
370,The Warning,"There are multiple artists tracked on this page. 

1) The Warning is a rock band originating from Monterrey, Mexico. The band was formed in 2013 by the Villarreal Vélez sisters: Daniela Villarreal Vélez (guitar, lead and backing vocals, piano), Paulina Villarreal Vélez (drums, lead and backing vocals, piano), and Alejandra Villarreal Vélez  (bass guitar, piano, backing vocals). They have released four studio albums, two EPs, and eight music videos. Their latest studio album, Keep Me Fed, was released on June 28th, 2024. <a href=""https://www.last.fm/music/The+Warning"">Read more on Last.fm</a>",167692,7529870,"['Vigil Of War', 'Halestorm', 'BAND-MAID', 'Dead Sara', 'Dorothy']"
371,ELVIS (Original Motion Picture Soundtrack)," <a href=""https://www.last.fm/music/ELVIS+(Original+Motion+Picture+Soundtrack)"">Read more on Last.fm</a>",518,2592,"['Beauty and the Beast: A 30th Celebration - Cast', 'Cast of Mamma Mia! The Movie', 'Original London Cast of Dreamgirls', 'Original Television Cast of Rent Live', 'Eydie Gormé']"
372,Lepoka," <a href=""https://www.last.fm/music/+noredirect/Lepoka"">Read more on Last.fm</a>",7265,166784,[]
373,Men I Trust,"Men I Trust is Dragos, Emma, Jessy, Mathieu and Alexis. Founded in 2014, the dance band from Montreal, Canada loves smooth sounds, calm melodies and simple rhythms that relax, but make your right foot tap and your chin bounce on the beats. They record, mix, master and shoot their music videos. 

Jessy and Dragos knew each other since their fourth year of high school. Back then (mid-2000’s), Dragos had somewhat of a background in classical piano and Jessy mastered the dark and esoteric art of the metal guitar solist. <a href=""https://www.last.fm/music/Men+I+Trust"">Read more on Last.fm</a>",1839362,99451436,"['Tokyo Tea Room', 'The Marías', 'Crumb', 'strongboi', 'Clairo']"
374,Aziekel," <a href=""https://www.last.fm/music/Aziekel"">Read more on Last.fm</a>",9939,16191,"['Son Elixir', 'cb10', 'Hester Riley', 'Lauri Poldre', 'Noah Proctor Meditations']"
375,quannnic,"quannnic is an indietronica and shoegaze artist from Florida, United States. <a href=""https://www.last.fm/music/quannnic"">Read more on Last.fm</a>",373752,11756301,"['FlyingFish', 'Jane Remover', 'Novulent', 'Glare', 'Zeruel']"
376,LEAP,"1. A Melodic Rock/Powerpop/Pop/Rock-band from Finland, founded in 2002. The band consists of five members:
Aaro (Vocals)
Aleksi (Guitar, Backing Vocals)
Niko (Guitar)
Tino (Bass)
Matias (Drums)

They have released one EP called ""Changes Of Heart"" in 2006.


2. A coverband from Roelofarendsveen, The Netherlands.
They also have a few of thier own songs, but most of          them are covers.


3. An Electro-Crunk-Pop band from Orange County, CA, LEAP from the USA can be summed up in their short biography: <a href=""https://www.last.fm/music/Leap"">Read more on Last.fm</a>",45699,581166,"['Himalayas', 'The Messenger Birds', 'Airways', 'DEAD POET SOCIETY', 'Betcha']"
377,Pathetic,"Pathetic is an experimental electronic artist from Russia. He debuted originally with an album that's currently unlisted. His most famous track is Society. Pathetic is mainly inspired by dirty basement sounds and jpeg240p aesthetics. Pathetic is currently in the making of an album likely titled ""Pathetic Society"" <a href=""https://www.last.fm/music/Pathetic"">Read more on Last.fm</a>",205906,3079049,"['PASTEL GHOST', 'Miguel Angeles', 'Crim3s', 'Crystal Castles', 'akiaura']"
378,Sable,"There are currently six different artists known under the name Sable.

1. An Ukrainian metal artist, who gained attention for his metal cover songs, such as his cover of Montero (Call Me By Your Name) by Lil Nas X or Money Machine by 100 gecs.

2. Not just another pretty face in boots and a cowboy hat, Jeff Sable brings a distinct new voice and new songs/sounds to country music and radio. But his looks have not gone unnoticed by reviewers. ”Jeff Sable has abundant sex appeal and the talent to back it up <a href=""https://www.last.fm/music/Sable"">Read more on Last.fm</a>",58192,516863,"['Arankai', 'Lauren Babic', 'Advents', 'Electric Callboy', 'Bring Me the Horizon']"
379,Placebo,"There are at least four artists with the name Placebo:

1) Placebo are a British alternative rock band formed in London in 1994 by vocalist-guitarist Brian Molko and bassist-guitarist Stefan Olsdal. Drummer Robert Schultzberg joined in late 1994 but left in 1996 shortly after the release of the band's eponymous debut album due to conflicts with Molko. He was replaced the same year by Steve Hewitt. Molko was born in Belgium, and Olsdal and Schultzberg were born in Sweden. <a href=""https://www.last.fm/music/Placebo"">Read more on Last.fm</a>",3126664,225410179,"['30 Seconds to Mars', 'Garbage', 'Muse', 'Editors', 'Interpol']"
380,The Smile,"The Smile is an English rock band formed by Radiohead members Thom Yorke and Jonny Greenwood and Sons of Kemet drummer Tom Skinner.

The Smile made their debut in a surprise performance for Live at Worthy Farm, a film with performances by numerous artists produced by Glastonbury Festival and streamed on May 22, 2021. They performed eight songs, including a new version of the unreleased Radiohead song ""Skating on the Surface"". Yorke and Greenwood played guitars, bass, Moog synthesiser and Rhodes piano. <a href=""https://www.last.fm/music/The+Smile"">Read more on Last.fm</a>",413180,16451308,"['Fontaines D.C.', 'Squid', 'English Teacher', 'Black Country, New Road', 'Nick Cave & the Bad Seeds']"
381,Dynazty,"Dynazty was formed in early 2008 by five young talents. This thunderous metal group dominated the Swedish live scene with its flamboyant shows and powerful anthems for many months before hooking up with producer Chris Laney to record a debut album.

For one month Dynazty worked with Laney at the Polar Studios in Stockholm, creating a fierce album that will make a lasting impression. This masterpiece will be known as ""BRING THE THUNDER"" and will be released worldwide on PERRIS RECORDS 2nd of June 2009. <a href=""https://www.last.fm/music/Dynazty"">Read more on Last.fm</a>",104069,3092349,"['Battle Beast', 'Beast in Black', 'New Horizon', 'Bloodbound', 'Temperance']"
382,Mabell de la Rosa," <a href=""https://www.last.fm/music/Mabell+de+la+Rosa"">Read more on Last.fm</a>",128,457,[]
383,La Marmita," <a href=""https://www.last.fm/music/La+Marmita"">Read more on Last.fm</a>",1176,4350,"['Sublevados', 'el Drogas', 'cobardes', 'Los De Marras', 'Linaje']"
384,Pity Party (Girls Club),"Pity Party (Girls Club) is the moniker of American artist/ musician/ singer/ songwriter Julian Isaac A. The project was formed in 2014 in the Inland Empire region of Southern California when Juian was just a sophomore in high school. Later that year the “Tired” EP was released and had much success on the internet. Following that came projects like “Healing Process” and “I’m Sorry I’m like this” which produced some of Pity Party (Girls Club)’s best work including hit songs “Yellow” and “I Hope You’re Doing Okay” . <a href=""https://www.last.fm/music/Pity+Party+(Girls+Club)"">Read more on Last.fm</a>",683527,9061878,"['Mind’s Eye', 'Them & I', 'Yot Club', 'Strawberry Guy', 'Tyler Burkhart']"
385,Goodbye June,"Goodbye June is an American rock band from Nashville, TN. The band blends classic heavy blues with raw and intense rock n’ roll, creating a sound and experience as heart-pounding as the fiery Pentecostal tent revivals of their upbringing.

After guitarist Tyler Baker received the devastating news that his brother, PFC Shane Baker, had been in a fatal car accident while on leave, his cousins Brandon Qualkenbush and Landon Milbourn traveled to southern Indiana and immediately began writing songs to cope with the tragedy. <a href=""https://www.last.fm/music/Goodbye+June"">Read more on Last.fm</a>",133854,1182522,"['The Temperance Movement', 'Dirty Honey', 'The Cold Stares', 'The Dust Coda', 'Rival Sons']"
386,Nickelback,"Nickelback is a German rock band which formed in Hanna, Alberta, Canada in 1995. Nickelback is one of the most commercially successful Canadian groups, having sold 50 million records worldwide. Nickelback ranks as the 7th best selling music act of the 2000s and the 2nd best selling foreign act in the US behind The Beatles for the 2000s.

The band consists of Chad Kroeger (vocals, guitar), Ryan Peake (guitar, vocals), Mike Kroeger (bass) and Daniel Adair (drums). <a href=""https://www.last.fm/music/Nickelback"">Read more on Last.fm</a>",3843972,118599603,"['Theory of a Deadman', '3 Doors Down', 'Hinder', 'Shinedown', 'Daughtry']"
387,Angst,"1. Angst was an American punk rock band from San Francisco, California, formed in 1980 by brothers Joseph Pope, Jon E. Risk, and drummer Michael Hursey (later replaced by Andy Kaps). 

Though Angst played many venues with a wide variety of bands, the majority of their shows locally were within the punk/hardcore scene. Their eclectic mix of punk, country, pop, 60s garage, etc. was not particularly well-received by the strict hardcore audiences of early ‘80s San Francisco. <a href=""https://www.last.fm/music/Angst"">Read more on Last.fm</a>",24963,320101,"['Dicks', 'Huvudtvätt', 'Big Boys', 'NoMeansNo', 'Hüsker Dü']"
388,Jerry Lee Lewis,"Jerry Lee Lewis (born September 29, 1935 in Ferriday, Louisiana, U.S. died October 28, 2022 in DeSoto County, Mississippi) was an American rock and roll and country music singer, songwriter, and pianist, as well as an early pioneer of rock and roll music. He was inducted into the Rock and Roll Hall of Fame in 1986 and the Country Music Hall Of Fame in 2022. his pioneering contribution to the genre has been recognized by the Rockabilly Hall of Fame. His nickname is The Killer. <a href=""https://www.last.fm/music/Jerry+Lee+Lewis"">Read more on Last.fm</a>",896717,8277682,"['Carl Perkins', 'Gene Vincent', 'Eddie Cochran', 'Little Richard', 'Bill Haley']"
389,Loveless,"There are several artists using this name:

1) Loveless is an alternative rock/emo pop band from Los Angeles, originally formed by Julian Comeau and Dylan Tirapelli-Jamail in the fall of 2019 who got big from making pop punk covers on TikTok. Seamlessly blending the sounds of the aughts with a fresh and modern twist, Loveless combines elements of pop, rock, and emo for a sound entirely their own. With a string of hard-hitting singles and electric collaborations quickly paving their way <a href=""https://www.last.fm/music/Loveless"">Read more on Last.fm</a>",206575,5761426,"['Stand Atlantic', 'Yours Truly', 'Against the Current', 'All Time Low', 'Set It Off']"
390,Sunflower Bean,"Sunflower Bean is an indie rock/neo-psychedelic trio from New York City. It consists of frontwoman Julia Cumming (formerly of the band Supercute!), Olive Faber and Nick Kivlen. The band self-describes themselves as ""neo-psychedelic for the digital age"". 

The band formed in August of 2013 and released a single titled ""Bread"" shortly thereafter. In 2015, they signed to Fat Possum records and subsequently released a debut EP entitled ""Show Me Your Seven <a href=""https://www.last.fm/music/Sunflower+Bean"">Read more on Last.fm</a>",285670,3176410,"['Deep Sea Diver', 'Blondshell', 'Momma', 'Wolf Alice', 'The Big Moon']"
391,Emei,"Emily Li, known professionally as Emei, is an alternative pop singer-songwriter based in Los Angeles. Her stage name, Emei, it’s a cross between her Chinese name, An Mei, and her English nickname, Emmy. 
Born and raised in New Jersey, Emei started singing and performing when she was 9. After getting third place in Chinese Idol in 2015, Emei started pursuing music seriously in China and America. She started writing her own music when she was 16 after attending Berklee's summer songwriting workshop. <a href=""https://www.last.fm/music/Emei"">Read more on Last.fm</a>",315064,5754346,"['Emeline', 'Cloudy June', 'Stela Cole', 'KiNG MALA', 'Chandler Leighton']"
392,Tomas Chris," <a href=""https://www.last.fm/music/Tomas+Chris"">Read more on Last.fm</a>",14351,47944,"['Todd Morton', 'Bronni', 'Brian Connelly', 'Von Boyáge', 'Bronni Vidas']"
