,nombre_artista,bio,listeners,playcount,similar
256,Fran Mariscal," <a href=""https://www.last.fm/music/Fran+Mariscal"">Read more on Last.fm</a>",1470,11046,"['Lena Carrilero', 'Capitán Cobarde', 'El Vicio Del Duende', 'cobardes', 'Héroes 2020']"
257,llvna," <a href=""https://www.last.fm/music/llvna"">Read more on Last.fm</a>",4000,63380,"['Enol', 'Hens', 'Stormykid', 'Xavibo', 'céro']"
258,Imagine Dragons,"Imagine Dragons are a pop band formed in 2008, based in Las Vegas, Nevada. The band currently consists of lead singer Dan Reynolds, guitarist Wayne Sermon, and bassist Ben McKee. They first gained exposure with the release of their single ""It's Time"", followed by their debut album Night Visions (2012), which resulted in the chart-topping singles ""Radioactive"" and ""Demons"". Rolling Stone named ""Radioactive"", which held the record for most weeks charted on the Billboard Hot 100, the ""biggest rock hit of the year"". <a href=""https://www.last.fm/music/Imagine+Dragons"">Read more on Last.fm</a>",3649715,218173384,"['OneRepublic', 'American Authors', 'X Ambassadors', 'Bastille', 'Coldplay']"
259,The Offspring,"The Offspring are a punk rock band formed in Huntington Beach, California, United States in 1984. From 1987 to 2003, the band's line-up included Dexter Holland (lead vocals, guitar), Noodles (lead and rhythm guitars, back vocals), Greg K. (bass, back vocals), and Ron Welty (drums, percussion), who was fired in 2003. Their current drummer is Brandon Pertzborn of Marilyn Manson who has been with the band since 2023. Greg K was fired from the band in 2018 and was replaced by Todd Morse. <a href=""https://www.last.fm/music/The+Offspring"">Read more on Last.fm</a>",4103183,179861743,"['Pennywise', 'Sum 41', 'Bad Religion', 'Green Day', 'Rise Against']"
260,Marlon,"There are four artists with this name:

1. Marlon (born August 24, 1977 in Cuba) is a Cuban singer, better known as the winner of the third season of Objetivo Fama, a Puerto Rican reality-show -singing talent contest broadcast by Univision Puerto Rico, and Telefutura network in the United States.

Marlon Fernández was born in La Lisa, Cuba in 1977 to José and Raquel Fernández. At the age of 14, he formed a five-piece band that would help him in his future career. <a href=""https://www.last.fm/music/Marlon"">Read more on Last.fm</a>",31022,474989,"['Fran Perea', 'Flynn Bridgewater', 'DCS', 'Mellow Strings', 'Harmonic Fusion']"
261,Iron Maiden,"Iron Maiden is an English heavy metal band formed in Leyton, East London, in 1975 by bassist and primary songwriter Steve Harris. While fluid in the early years of the band, the lineup for most of the band's history has consisted of Harris, lead vocalist Bruce Dickinson, drummer Nicko McBrain, and guitarists Dave Murray, Adrian Smith and Janick Gers. The band have released 41 albums, including 17 studio albums, 13 live albums, four EPs and seven compilations. <a href=""https://www.last.fm/music/Iron+Maiden"">Read more on Last.fm</a>",2862608,227124246,"['Bruce Dickinson', 'Judas Priest', 'Dio', 'Black Sabbath', 'Helloween']"
262,Robe,"This is an incorrect tag for the artist Robe. .  If this non-artist appears in your charts, please fix your tags. <a href=""https://www.last.fm/music/+noredirect/Robe"">Read more on Last.fm</a>",16275,832338,[]
263,Los Fabulosos Cadillacs,"Los Fabulosos Cadillacs from Buenos Aires, Argentina play ska, rocksteady, reggae, rock, jazz, salsa, folk, rap, big band. Formed 1985, their first album, Bares y Fondas  came 1986. 1998 they got a Grammy for Best Latin Rock/Alternative Album. They also won the MTV Latino Video Music Award in 1994 for the single 'El Matador' – which was on the soundtracks for the movies Savages, Grosse Pointe Blank and The Matador. Singer Gabriel Fernandez Capello (known as Vicentico) and bassist Flavio Cianciarulo are core members and songwriters. <a href=""https://www.last.fm/music/Los+Fabulosos+Cadillacs"">Read more on Last.fm</a>",492076,9786866,"['Los Auténticos Decadentes', 'Los Pericos', 'Vicentico', 'Bersuit Vergarabat', 'Los Rodríguez']"
264,Kamikazes," <a href=""https://www.last.fm/music/Kamikazes"">Read more on Last.fm</a>",3541,114182,"['Prezident', 'Prezident & Dubios', 'Prezident & Kamikazes', 'Kamikaze Brothers', 'Destroy Degenhardt']"
265,Benito Kamelas,"The spanish rock group BENITO KAMELAS se caracteriza por hacer un Rock fresco, cotidiano y divertido pero lo mejor es su puesta en escena. En Diciembre de 1997 graban un Cd con seis cortes (QUE MÁS DA)y empiezan a moverlo sin ningún tipo de apoyo de ninguna compañía, promocionandolo en directo por capitales como Teruel, Zaragoza, Córdoba, Tarragona, Castellón, y Alicante.
Asombrados por haber vendido 1.500 copias (mano en mano y algún garito) <a href=""https://www.last.fm/music/Benito+Kamelas"">Read more on Last.fm</a>",15169,304312,"['Los De Marras', 'Sinkope', 'Poncho K', 'Forraje', 'Fe De Ratas']"
266,THE DRIVER ERA,"The Driver Era is an American alternative music band/musical duo composed of former R5 band members Rocky and Ross Lynch. It was officially formed on March 1, 2018.

On March 1, 2018, R5's social networks had their name changed to The Driver Era and all posts deleted. On March 2, it was confirmed that The Driver Era was a new band consisting of Ross and Rocky. On the same day, promotional videos were released for their first single, ""Preacher Man"", to be released on March 16th. <a href=""https://www.last.fm/music/The+Driver+Era"">Read more on Last.fm</a>",440813,13590503,"['R5', 'Luke Hemmings', 'Wallows', 'The Vamps', '5 Seconds of Summer']"
267,The Rare Occasions,"The Rare Occasions is an American indie rock band, formed in Boston in 2012. Current members are Brian McLaughlin (vocals, guitar), Jeremy Cohen (bass guitar, backup vocals) and Luke Imbusch (drums, backup vocals). Lead guitarist Peter Stone left in 2018. The band's debut release was the Demo Recordings EP (2012). In 2016, Futureproof was released as a fourth EP. ""Notion"", a song from the EP, went viral on TikTok in October 2021. Their most recent release has been Macaroni Moon as of July 1st, 2024. <a href=""https://www.last.fm/music/The+Rare+Occasions"">Read more on Last.fm</a>",916792,14945394,"['Phoneboy', 'Good Kid', 'The Happy Fits', 'Last Dinosaurs', 'Kevin Walkman']"
268,Andrés Calamaro,"Andres Calamaro is one of the most popular Argentinian pop-rock songwriters. A songs craftsman, as he likes to consider himself.

Born Aug 22, 1961 in Buenos Aires, Argentina, he began his professional musical career at the age of 17 playing keyboards in Raíces.
In 1981 he incorporated to one of the main bands of the Argentinean '80s rock scene: Los Abuelos de la Nada. Although the band was led by the brilliant Miguel Abuelo, Calamaro composed most of the band's hits <a href=""https://www.last.fm/music/+noredirect/Andr%C3%A9s+Calamaro"">Read more on Last.fm</a>",417554,14787781,"['Los Rodríguez', 'Fito Páez', 'Intoxicados', 'Los Abuelos de la Nada', 'Bersuit Vergarabat']"
269,IDLES,"Idles are an English post-punk band formed in Bristol, England in 2009. The success of the band’s debut EP “Welcome” did not go unnoticed and so it happened that BBC Introducing in the Southwest honoured the group as “Band of The Year” in 2012.

After a hiatus, the band returned in 2015 with “MEAT EP” and “META EP”. “Divide & Conquer” and “Well Done” were released in 2016, when it was announced their debut album “Brutalism” was released on March the 10th <a href=""https://www.last.fm/music/Idles"">Read more on Last.fm</a>",532514,33906096,[]
270,Limp Bizkit,"Limp Bizkit are an American nu metal band from Jacksonville, Florida. Their lineup consists of Fred Durst (lead vocals), Sam Rivers (bass, backing vocals), John Otto (drums, percussion), DJ Lethal (turntables), and Wes Borland (guitars, vocals). Their music is marked by Durst's angry vocal delivery and Borland's sonic experimentation. Borland's elaborate visual appearance, which includes face and body paint, masks and uniforms, also plays a large role in the band's live shows. <a href=""https://www.last.fm/music/Limp+Bizkit"">Read more on Last.fm</a>",3556815,137026455,"['Korn', 'Primer 55', 'Snot', 'Slipknot', 'P.O.D.']"
271,The Dirty Shirts," <a href=""https://www.last.fm/music/The+Dirty+Shirts"">Read more on Last.fm</a>",7565,19948,"['Hidden Pillars', 'ALMA CORA', 'Land Of Valen', 'MoRunDo', 'The Royal Foundry']"
272,jxdn,"Born Jaden Hossler, in Dallas, TX, jxdn struggled to find his voice in high school as an outsider. In 2018, he took control and developed a presence online through a consistent stream of engaging and clever content. He quietly exploded on Tik Tok, attracting 9.3 million followers and 283.8 million likes. After witnessing an arena show by the late Juice WRLD, he dove headfirst into music and unleashed his independent debut single “Comatose.” The <a href=""https://www.last.fm/music/jxdn"">Read more on Last.fm</a>",327559,10416587,"['mgk', 'MOD SUN', 'Beauty School Dropout', 'iann dior', 'Tyler Posey']"
273,Huecco,"Ivahn was the singer of ""Sugarless"", a Spanish hard rock band. In 2005 he moved to L.A. to record his first maxi single as singer. ""Huecco"" is the name of his new band. It sounds like a mix of rumba, reagge, rock, spanish sounds, samba, punk, hiphop and ska, which is called Rumbaton. He mixed flamenco guitars with electric ones to make riffs.
KC Porter (Santana, Fabulosos Cadillacs, Ricky Martin, Boyz II Men, Bon Jovi) produced his album and Thom Russo(SOAD, Audioslave, Michael Jackson) mixed it. <a href=""https://www.last.fm/music/Huecco"">Read more on Last.fm</a>",58855,731385,"['Alvaro Soler', 'Los Aslándticos', 'Sofia Reyes', 'Pereza', 'La Fuga']"
274,late night drive home,"late night drive home is an indie rock band from El Paso, Texas consisting of lead singer Andre Portillo, guitarist Juan ""Ockz"" Vargas, bassist Freddy Baca, and drummer Brian Dolan. Their music captures everything from the complexity of teenage angst to the beauty of youthful joy. With heartfelt lyrics and a gritty sound, late night drive home brings a refreshing presence into the indie rock scene.

The band began in 2019 as a fun project between Ockz and Andre. <a href=""https://www.last.fm/music/late+night+drive+home"">Read more on Last.fm</a>",441418,8704794,"['Mind’s Eye', 'Yot Club', 'High Sunn', 'Phoneboy', 'Strawberry Milk Cult']"
275,Barua," <a href=""https://www.last.fm/music/Barua"">Read more on Last.fm</a>",2863,27310,"['Samurai Resistance', 'RIZARDI', 'Quil', 'Morita yuuhei', 'XANVEL']"
276,Billy Idol,"William Michael Albert Broad, known professionally as Billy Idol, is a British singer, songwriter, musician and actor. He also holds United States citizenship. He first achieved fame in the 1970s emerging from the London punk rock scene as the lead singer of the group Generation X. Subsequently, he embarked on a solo career which led to international recognition and made Idol a lead artist during the MTV-driven ""Second British Invasion"" in the US. The name ""Billy Idol"" was inspired by a schoolteacher's description of him as ""idle"". <a href=""https://www.last.fm/music/Billy+Idol"">Read more on Last.fm</a>",2525124,43865390,"['Generation X', 'Duran Duran', 'INXS', 'The Police', 'Foreigner']"
277,Poncho K,"Poncho K, nombre artístico de Alfonso Caballero Romero, es un músico de rock nacido en Sevilla cuya música se caracteriza por la contundencia y el surrealismo de sus letras.
Sus influencias van desde Triana a Pata Negra pasando por Extremoduro o Albert Pla y él mismo define su música afirmando: ""Lo mío es rock con pinceladas flamencas, poesía callejera.

Discografía:

* No quiero empates. (2002) BMG
* Destino de pluma y mano. (2003) BMG
* Cuantovaqueré. (2005) BMG <a href=""https://www.last.fm/music/Poncho+K"">Read more on Last.fm</a>",39414,612383,"['Forraje', 'Albertucho', 'Silencio Absoluto', 'Los Reconoces', 'Sinkope']"
278,Huntza,"Huntza are a Basque folk rock band from Bilbao, formed in 2014. The word Huntza is a Basque noun which means ""ivy"".

The band was created in the streets of Bilbao in 2014. All the members are from different towns of Gipuzkoa.

The band first appeared on 8 March 2016 when they released the song ""Harro gaude"". On November 2016, they published the single ""Aldapan gora"", whose music video later became the most viewed song in Basque language on YouTube. The song was included in their first studio album, ""Ertzetatik"", released in 2016. <a href=""https://www.last.fm/music/Huntza"">Read more on Last.fm</a>",7540,172260,"['En Tol Sarmiento', 'Bulego', 'NØGEN', 'ZetaK', 'Xabi Solano Maiza']"
279,Cableados," <a href=""https://www.last.fm/music/Cableados"">Read more on Last.fm</a>",405,1598,"['Debruces', 'La Marmita', 'La Sombra del Grajo', 'Mala Hierba', 'Txema Benítez']"
280,Carta Blanca," <a href=""https://www.last.fm/music/carta+blanca"">Read more on Last.fm</a>",281,4401,"['La Marmita', 'Descantilleos', 'ExtreChinato y Tú', 'Sublevados', 'Benito Kamelas']"
281,Sublevados," <a href=""https://www.last.fm/music/Sublevados"">Read more on Last.fm</a>",1607,17545,"['Fe De Ratas', 'Estrago', 'Benito Kamelas', 'Los De Marras', 'Sinkope']"
282,Heroes Del Silencio,"Héroes del Silencio (sometimes referred to as just Héroes) is a Spanish rock band from Zaragoza (Aragón, Spain) formed by Juan Valdivia. In the 1990s they experienced success around Spain and the Americas, and various European countries including Germany, Belgium, Switzerland, France and Portugal becoming a successful Spanish group and a fact in the history of the Rock en Español scene. After ten years and numerous albums, the band broke up in 1997. <a href=""https://www.last.fm/music/+noredirect/Heroes+Del+Silencio"">Read more on Last.fm</a>",110551,2708226,[]
283,Ragged Insomnia," <a href=""https://www.last.fm/music/Ragged+Insomnia"">Read more on Last.fm</a>",9641,88850,"['Imagine Dragons', 'Oh The Larceny', 'Mushmellow', 'The Faim', 'Animal Джаz']"
284,Inhaler,"Inhaler is an alternative rock band formed in 2016 in Dublin  consisting of Elijah Hewson (voc, git), Josh Jenkinson (git), Robert Keating (aka Bobby Skeetz, bass) and Ryan McMahon (dr). The band released their first single, I Want You in 2017. The band were signed to Polydor an English label-- in July 2019 and embarked on their first tour of the US. The band were tipped for success in 2020 when they ranked at number 5 in BBC's Sound of... music poll. <a href=""https://www.last.fm/music/Inhaler"">Read more on Last.fm</a>",441774,22650114,"['Sam Fender', 'Catfish and the Bottlemen', 'Overpass', 'Wunderhorse', 'Blossoms']"
285,Keanu Bicol," <a href=""https://www.last.fm/music/Keanu+Bicol"">Read more on Last.fm</a>",105660,1950415,"['INOHA', 'Phoneboy', 'Andrew Garden', 'The Rare Occasions', 'Last Dinosaurs']"
286,Los Auténticos Decadentes,"Los Auténticos Decadentes (Spanish for ""The Authentic Decadents"") is an Argentine band that mixes ska with Latin American rhythms. The band was formed around 1986 by Cucho and Nito, who invited Gastón to join them.

Their first hit was Veni Raquel, which set the tone for their later lyrics' irreverence and ironic humor. Many of their songs are classic anthems of Argentinian nightlife, such as Corazón, Loco (Tu Forma de Ser), Entregá el Marrón, La Guitarra, Los Piratas, and El Murguero. <a href=""https://www.last.fm/music/+noredirect/Los+Aut%C3%A9nticos+Decadentes"">Read more on Last.fm</a>",262050,4692106,"['Los Fabulosos Cadillacs', 'Vicentico', 'Bersuit Vergarabat', 'Turf', 'Attaque 77']"
287,Lasso,"1) Hardcore punk de Salvador, BA, Brasil
Ordem Imaginada 7” preorder available from @sorrystate (US) and @staticshockrecords (UK)
https://sorrystaterecords.bandcamp.com/album/ordem-imaginada

2) Andrés Vicente Lazo Uslar (Caracas, Venezuela, 18 de febrero de 1988), más conocido por su nombre artístico Lasso, es un cantante, actor y compositor venezolano. <a href=""https://www.last.fm/music/Lasso"">Read more on Last.fm</a>",123327,2476936,"['Danny Ocean', 'Lagos', 'Caramelos de Cianuro', 'Rawayana', 'Los Mesoneros']"
288,WILLOW,"There are at least six artists with this name:
1. Willow Smith, an American pop singer
2. An American instrumental group
3. A Belgian indie rock band
4. An American singer/songwriter
5. A Dutch rock band
6. An American math rock band
7. Sophie Wilson, a UK-based producer.
8. German hard rock band, 1990s.

1. Willow Camille Reign Smith (born October 31, 2000 in Los Angeles, United States) is an American child actress and singer who is the daughter of Will Smith and Jada Pinkett Smith. <a href=""https://www.last.fm/music/Willow"">Read more on Last.fm</a>",1899716,62740389,"['The Anxiety', 'Chloe x Halle', 'Solange', 'Normani', 'Doja Cat']"
289,Kevin Walkman," <a href=""https://www.last.fm/music/Kevin+Walkman"">Read more on Last.fm</a>",129748,2280317,"['Phoneboy', 'adan diaz', 'The Polar Boys', 'Mickey Darling', 'The Happy Fits']"
290,Foo Fighters,"Foo Fighters are an American rock band formed in Seattle in 1994. Foo Fighters was initially formed as a one-man project by former Nirvana drummer Dave Grohl. Following the success of the eponymous debut album, Grohl (lead vocals, guitar) recruited a band consisting of Nate Mendel (bass guitar), William Goldsmith (drums), and Pat Smear (guitar). After a succession of lineup changes, including the departures of Goldsmith and Smear, the band formed its core lineup in 1999 consisting of Grohl <a href=""https://www.last.fm/music/Foo+Fighters"">Read more on Last.fm</a>",5717369,302396015,"['Taylor Hawkins & The Coattail Riders', 'Pearl Jam', 'Nirvana', 'Them Crooked Vultures', 'Audioslave']"
291,Citizen Soldier,"Since Citizen Soldier's debut in 2017, the Salt Lake City-based music group has been all about honoring those who fight battles every day that other dismiss or judge them for. Those battling mental illness, abuse, stigmatization, and being ostracized have embraced their music as a representation of their own stories and struggles. As the community has grown and word has spread, many have found a refuge of survivors to share in their pain.

""This Is Your Sign"" captures a pivotal moment for Citizen Soldier. <a href=""https://www.last.fm/music/Citizen+Soldier"">Read more on Last.fm</a>",99812,5069786,"['Lø Spirit', 'Letdown.', 'Self Deception', 'Smash Into Pieces', 'Adelitas Way']"
292,Saint Chaos," <a href=""https://www.last.fm/music/Saint+Chaos"">Read more on Last.fm</a>",69317,886258,"['Zayde Wølf', 'Adam Jensen', 'JAXSON GAMBLE', ""The People's Thieves"", 'Arrested Youth']"
293,Against The Current,"Against the Current is a pop-punk band that formed in Poughkeepsie, New York in 2011. Led by singer Chrissy Costanza, guitarist/singer Dan Gow, and drummer Will Ferri, they initially built up a large following on YouTube covering songs like Owl City and Carly Rae Jepsen's ""Good Time"" and Kelly Clarkson's ""Catch My Breath."" Their own debut single, ""Thinking,"" arrived in July 2012, followed a year later by ""Closer, Faster,"" the latter of which also appeared on their debut EP ''Infinity' in 2014. <a href=""https://www.last.fm/music/Against+the+Current"">Read more on Last.fm</a>",249427,11227998,"['Chrissy Costanza', 'Yours Truly', 'Hot Milk', 'We Are the In Crowd', 'Tonight Alive']"
294,Friday Pilots Club,"Recently signed to Big Machine/John Varvatos Records (Big Machine Label Group), Friday Pilots Club is Chicago’s Pop affected and hard-hitting Rock band.

Formed in 2017, members Caleb Hiltunen (vocals) and Drew Polovick (guitar) blend explosive memorable hooks and eclectic musical sensibilities to bring a fresh sound to the world of Rock music.

While attending Columbia College Chicago and pursuing different degrees, Caleb and Drew became instant fans of each other’s work. <a href=""https://www.last.fm/music/Friday+Pilots+Club"">Read more on Last.fm</a>",221722,7325390,"['WHALES•TALK', 'Himalayas', 'Airways', 'The Wrecks', 'Betcha']"
295,Mitchel Dae," <a href=""https://www.last.fm/music/Mitchel+Dae"">Read more on Last.fm</a>",39416,683492,"['Poe the Passenger', 'Connor Kauffman', 'Layto', 'Chri$tian Gate$', 'Jagwar Twin']"
296,Dead Poet Society,"Dead Poet Society is a rock band from Boston, Massachusetts. 

Members:	
Lead vocals/Guitar-Jack Underkofler
Guitar-Jack Collins
Bass-Dylan Brenner
Drums-Will Goodroad <a href=""https://www.last.fm/music/DEAD+POET+SOCIETY"">Read more on Last.fm</a>",222265,6031737,"['Cleopatrick', 'Des Rocs', 'Highly Suspect', 'Nothing But Thieves', 'Airways']"
297,Santana,"Santana is a Latin music and rock band formed in San Francisco, California in 1966 by Mexican-American guitarist Carlos Santana. The band came to public attention with their performance of ""Soul Sacrifice"" at Woodstock in 1969. This exposure helped propel their first album, also named Santana, into a hit, followed in the next two years by Abraxas and Santana III. Lineup changes were common. Carlos Santana's increasing involvement with guru Sri Chinmoy took the band into more esoteric music, though it never lost its Latin influence. <a href=""https://www.last.fm/music/Santana"">Read more on Last.fm</a>",2536327,44188257,"['Carlos Santana', 'Jeff Beck', 'Eric Clapton', 'Dire Straits', 'The Allman Brothers Band']"
298,Wine Lips,"Toronto-based garage punk psych rockers Wine Lips took the stage for the first time in the fall of 2015. Initially, it was a part-time project between songwriter and guitar player Cam Hilborn and drummer Aurora Evans. The band started playing at clubs in Toronto and gradually expanded to surrounding cities and even ventured into Quebec. By mid-2017, it became evident that the band members were ready to commit full-time. Wine Lips released their self-titled debut LP on indie label Fried Records and embarked on their first tour <a href=""https://www.last.fm/music/Wine+Lips"">Read more on Last.fm</a>",191311,1681762,"['Teen Mortgage', 'Stiff Richards', 'Bad Nerves', 'The Clockworks', 'Frankie and the Witch Fingers']"
299,Iskender," <a href=""https://www.last.fm/music/Iskender"">Read more on Last.fm</a>",2537,33872,"['Astray', 'llvna', 'Triple Check', 'Enol', 'Chuly']"
300,Bayron Caicedo," <a href=""https://www.last.fm/music/Bayron+Caicedo"">Read more on Last.fm</a>",1063,12712,"['Angel Guaraca', 'MARIA DE LOS ANGELES', 'Maximo Escaleras', 'Hipatia Balseca', 'Star Band de Luis Alfredo']"
301,Gary Moore,"Gary Moore (born April 4, 1952 as Robert William Gary Moore in Belfast, Northern Ireland, United Kingdom; died February 6, 2011 in Malaga, Spain) is acknowledged as one of the finest guitarists to have originated in Ireland. He was a virtuoso guitarist and is considered by his fans to be one of the best guitar players ever.

In a career dating back to the 1960s he has played with bands including Thin Lizzy, Colosseum II, Greg Lake and Skid Row as well as having a successful solo career. <a href=""https://www.last.fm/music/Gary+Moore"">Read more on Last.fm</a>",872243,15081463,"['Joe Bonamassa', 'Thin Lizzy', 'Whitesnake', 'Snowy White', 'Philip Sayce']"
302,Jon and Roy,"'Jon and Roy' is a band based out of Victoria, B.C., Canada.   Members include Jon Middleton, Roy Vizer and Ryan Tonelli.   They have recorded three albums, Sittin' Back (2005), Another Noon (2008) and most recently, Homes (2010). 

In the past few years the band has travelled all over their home country of Canada, touring and sharing the stage with many international acts including The Cat Empire, Xavier Rudd, State Radio and Finley Quaye.  The summer of 2010 also saw them performing at the Winnipeg, Calgary and Vancouver Folk Festivals.   <a href=""https://www.last.fm/music/Jon+and+Roy"">Read more on Last.fm</a>",120909,1100841,"['Ocie Elliott', 'Dekker', 'Chris Staples', 'Nick Mulvey', 'Frazey Ford']"
303,Still Corners,"Still Corners is a band that formed in 2008 in London, England.  The group consists of duo Tessa Murray (vocals) and Greg Hughes (multi-instrumentalist/producer).  Since 2008 they've been joined by Leon Dufficy (guitar) and Luke Jarvis (bass) for live performances.  Jack Gooderham (drums) joined the live band in 2013.

Still Corners garnered wide critical success with a string of singles including the Don't Fall In Love/Wish 7-inch on cult label the <a href=""https://www.last.fm/music/Still+Corners"">Read more on Last.fm</a>",502481,10097762,"['New Constellations', 'Widowspeak', 'Jonathan Bree', 'Craft Spells', 'Blouse']"
304,EKKSTACY,"EKKSTACY is Canadian singer-songwriter Khyree Zienty (born 2002) from Vancouver, BC. He describes his current sound as a fuse of indie, post punk, and synth wave. 

Ekkstacy began creating music during high school, taking influence from film, and artists including Elliott Smith, The Drums, Bon Iver, and Bedroom. His music primarily involved youtube beats, in which he sang over. He released his debut EP Negative in November 2021, with the single ""I Walk This Earth All by Myself"" becoming what is considered to be his most popular song. <a href=""https://www.last.fm/music/EKKSTACY"">Read more on Last.fm</a>",751387,15296309,"['thornskin', 'SUMMER ALONE', 'Yot Club', 'kurffew', 'Mind’s Eye']"
305,The Blue Stones,"Hailing from Windsor, Ontario, The Blue Stones duo provide an edgy blues rock sound with accompanying alternative rock accents. The duo have been featured at Canadian Music Week; NXNE; FAM Fest; Shores of Erie Winefest and Orangeville Blues & Jazz Fest. In the last year, they've opened for acts such as The Stone Foxes, Current Swell, Justin Nozuka, Fitz and The Tantrums, Joel Plaskett and more. <a href=""https://www.last.fm/music/The+Blue+Stones"">Read more on Last.fm</a>",222309,3961037,"['Black Pistol Fire', 'The Record Company', 'Reignwolf', 'Royal Blood', 'BRKN LOVE']"
