,nombre_artista,bio,listeners,playcount,similar
255,Del Water Gap,"Del Water Gap is the solo project of American songwriter, producer, and singer Samuel Holden Jaffe. Born in New Haven, Connecticut, Jaffe currently resides in Brooklyn, New York. His music is known for its intimate nature, drawing inspiration from ""romantic encounters and dimly lit rooms.""

Jaffe's musical journey began while attending boarding school in Millbrook, New York. It was during this time that he adopted the name Del Water Gap, inspired by the sight of it handwritten on the back of a box truck. <a href=""https://www.last.fm/music/Del+Water+Gap"">Read more on Last.fm</a>",560475,15491989,"['Ethan Tasch', 'Coin', 'Maude Latour', 'Tommy Lefroy', 'Maggie Rogers']"
256,Iron Maiden,"Iron Maiden is an English heavy metal band formed in Leyton, East London, in 1975 by bassist and primary songwriter Steve Harris. While fluid in the early years of the band, the lineup for most of the band's history has consisted of Harris, lead vocalist Bruce Dickinson, drummer Nicko McBrain, and guitarists Dave Murray, Adrian Smith and Janick Gers. The band have released 41 albums, including 17 studio albums, 13 live albums, four EPs and seven compilations. <a href=""https://www.last.fm/music/Iron+Maiden"">Read more on Last.fm</a>",2865192,227326665,"['Bruce Dickinson', 'Judas Priest', 'Dio', 'Black Sabbath', 'Helloween']"
257,Robe,"This is an incorrect tag for the artist Robe. .  If this non-artist appears in your charts, please fix your tags. <a href=""https://www.last.fm/music/+noredirect/Robe"">Read more on Last.fm</a>",16339,836164,[]
258,Los Fabulosos Cadillacs,"Los Fabulosos Cadillacs from Buenos Aires, Argentina play ska, rocksteady, reggae, rock, jazz, salsa, folk, rap, big band. Formed 1985, their first album, Bares y Fondas  came 1986. 1998 they got a Grammy for Best Latin Rock/Alternative Album. They also won the MTV Latino Video Music Award in 1994 for the single 'El Matador' – which was on the soundtracks for the movies Savages, Grosse Pointe Blank and The Matador. Singer Gabriel Fernandez Capello (known as Vicentico) and bassist Flavio Cianciarulo are core members and songwriters. <a href=""https://www.last.fm/music/Los+Fabulosos+Cadillacs"">Read more on Last.fm</a>",492502,9801527,"['Los Auténticos Decadentes', 'Los Pericos', 'Vicentico', 'Los Rodríguez', 'Panteón Rococó']"
259,Kamikazes," <a href=""https://www.last.fm/music/Kamikazes"">Read more on Last.fm</a>",3549,114354,"['Prezident', 'Prezident & Dubios', 'Prezident & Kamikazes', 'Kamikaze Brothers', 'Destroy Degenhardt']"
260,Benito Kamelas,"The spanish rock group BENITO KAMELAS se caracteriza por hacer un Rock fresco, cotidiano y divertido pero lo mejor es su puesta en escena. En Diciembre de 1997 graban un Cd con seis cortes (QUE MÁS DA)y empiezan a moverlo sin ningún tipo de apoyo de ninguna compañía, promocionandolo en directo por capitales como Teruel, Zaragoza, Córdoba, Tarragona, Castellón, y Alicante.
Asombrados por haber vendido 1.500 copias (mano en mano y algún garito) <a href=""https://www.last.fm/music/Benito+Kamelas"">Read more on Last.fm</a>",15192,304836,"['Los De Marras', 'Sinkope', 'Poncho K', 'Forraje', 'Fe De Ratas']"
261,THE DRIVER ERA,"The Driver Era is an American alternative music band/musical duo composed of former R5 band members Rocky and Ross Lynch. It was officially formed on March 1, 2018.

On March 1, 2018, R5's social networks had their name changed to The Driver Era and all posts deleted. On March 2, it was confirmed that The Driver Era was a new band consisting of Ross and Rocky. On the same day, promotional videos were released for their first single, ""Preacher Man"", to be released on March 16th. <a href=""https://www.last.fm/music/The+Driver+Era"">Read more on Last.fm</a>",441484,13637583,"['R5', 'Luke Hemmings', 'Wallows', 'The Vamps', '5 Seconds of Summer']"
262,Limp Bizkit,"Limp Bizkit are an American nu metal band from Jacksonville, Florida. Their lineup consists of Fred Durst (lead vocals), Sam Rivers (bass, backing vocals), John Otto (drums, percussion), DJ Lethal (turntables), and Wes Borland (guitars, vocals). Their music is marked by Durst's angry vocal delivery and Borland's sonic experimentation. Borland's elaborate visual appearance, which includes face and body paint, masks and uniforms, also plays a large role in the band's live shows. <a href=""https://www.last.fm/music/Limp+Bizkit"">Read more on Last.fm</a>",3563297,137471191,"['Korn', 'Primer 55', 'Snot', 'Slipknot', 'System of a Down']"
263,Andrés Calamaro,"Andres Calamaro is one of the most popular Argentinian pop-rock songwriters. A songs craftsman, as he likes to consider himself.

Born Aug 22, 1961 in Buenos Aires, Argentina, he began his professional musical career at the age of 17 playing keyboards in Raíces.
In 1981 he incorporated to one of the main bands of the Argentinean '80s rock scene: Los Abuelos de la Nada. Although the band was led by the brilliant Miguel Abuelo, Calamaro composed most of the band's hits <a href=""https://www.last.fm/music/+noredirect/Andr%C3%A9s+Calamaro"">Read more on Last.fm</a>",418097,14825140,"['Los Rodríguez', 'Fito Páez', 'Intoxicados', 'Los Abuelos de la Nada', 'Bersuit Vergarabat']"
264,IDLES,"Idles are an English post-punk band formed in Bristol, England in 2009. The success of the band’s debut EP “Welcome” did not go unnoticed and so it happened that BBC Introducing in the Southwest honoured the group as “Band of The Year” in 2012.

After a hiatus, the band returned in 2015 with “MEAT EP” and “META EP”. “Divide & Conquer” and “Well Done” were released in 2016, when it was announced their debut album “Brutalism” was released on March the 10th <a href=""https://www.last.fm/music/Idles"">Read more on Last.fm</a>",533280,33968794,[]
265,The Rare Occasions,"The Rare Occasions is an American indie rock band, formed in Boston in 2012. Current members are Brian McLaughlin (vocals, guitar), Jeremy Cohen (bass guitar, backup vocals) and Luke Imbusch (drums, backup vocals). Lead guitarist Peter Stone left in 2018. The band's debut release was the Demo Recordings EP (2012). In 2016, Futureproof was released as a fourth EP. ""Notion"", a song from the EP, went viral on TikTok in October 2021. Their most recent release has been Macaroni Moon as of July 1st, 2024. <a href=""https://www.last.fm/music/The+Rare+Occasions"">Read more on Last.fm</a>",922105,15017877,"['Phoneboy', 'Good Kid', 'The Happy Fits', 'Last Dinosaurs', 'Kevin Walkman']"
266,Holding Absence,"Holding Absence is a rock band from Cardiff, Wales formed in 2015. The group consists of lead vocalist Lucas Woodland, guitarist Scott Carey, bassist Benjamin Elliot and drummer Ashley Green.

The band released an initial collection of singles in 2017, as well as a split EP with Loathe in 2018, before finally releasing their debut record, Holding Absence, in 2019. They are signed with SharpTone Records. In April 2021, they released their second album, 'The Greatest Mistake of My Life'. <a href=""https://www.last.fm/music/Holding+Absence"">Read more on Last.fm</a>",214847,8165498,"['Caskets', 'Dayseeker', 'Thousand Below', 'Casey', 'The Plot in You']"
267,KALEO,"Kaleo is an Icelandic blues rock band established in 2012 and their first major public appearance Iceland Airwaves Music Festival in November 2012. Their fame came through ""Vor í vaglaskógi"" as it was included on heavy rotation on Icelandic state broadcaster RÚV's radio station Rás 2 featuring on top of the stations Top 10.

The band consists of lead vocalist and guitarist Jökull Júlíusson, drummer David Antonsson, bassist Daniel Kristjansson, lead guitarist Rubin Pollock and harmonicist Þorleifur Gaukur Davíðsson. <a href=""https://www.last.fm/music/Kaleo"">Read more on Last.fm</a>",1051133,17704727,"['Welshly Arms', 'Royal Deluxe', 'The Blue Stones', 'Black Pistol Fire', 'Oh The Larceny']"
268,jxdn,"Born Jaden Hossler, in Dallas, TX, jxdn struggled to find his voice in high school as an outsider. In 2018, he took control and developed a presence online through a consistent stream of engaging and clever content. He quietly exploded on Tik Tok, attracting 9.3 million followers and 283.8 million likes. After witnessing an arena show by the late Juice WRLD, he dove headfirst into music and unleashed his independent debut single “Comatose.” The <a href=""https://www.last.fm/music/jxdn"">Read more on Last.fm</a>",327940,10435374,"['mgk', 'MOD SUN', 'Beauty School Dropout', 'iann dior', 'Sueco']"
269,Walls,"There is more than one artist with this name:

1) Walls is an electronic duo from United Kingdom, made up of members Sam Willis (of ALLEZ-ALLEZ) and Alessio Natalizia (of BANJO OR FREAKOUT).

They have released ""Walls"" (2010) and ""Coracle"" through Kompakt Records.

2) WALLS is a hardcore band from Seattle/Portland: Pounding rhythms, dissonant riffs, and a terrifying vocalist all come together to create something really brutal and powerful, featuring three fourths of the final Cold Sweat line up <a href=""https://www.last.fm/music/Walls"">Read more on Last.fm</a>",76234,1953127,"['Ulf Lohmann', 'Funzo & Baby Loud', 'Despistaos', 'Samuraï', 'Veintiuno']"
270,Rag'n'Bone Man,"Rory Charles Graham (born 29 January 1985), known professionally as Rag'n'Bone Man, is an English singer. He is known for his deep baritone voice. His first hit single, ""Human"", was released in 2016, and his first album Human was released in 2017. The album became the fastest selling debut album by a male in the UK for the decade and has since achieved 4× Platinum certification. At the 2017 Brit Awards, he was named British Breakthrough Act and received <a href=""https://www.last.fm/music/Rag%27n%27Bone+Man"">Read more on Last.fm</a>",757087,10123867,"['Teddy Swims', 'Jacob Banks', 'Tom Grennan', 'Lukas Graham', 'Ray Dalton']"
271,Billy Idol,"William Michael Albert Broad, known professionally as Billy Idol, is a British singer, songwriter, musician and actor. He also holds United States citizenship. He first achieved fame in the 1970s emerging from the London punk rock scene as the lead singer of the group Generation X. Subsequently, he embarked on a solo career which led to international recognition and made Idol a lead artist during the MTV-driven ""Second British Invasion"" in the US. The name ""Billy Idol"" was inspired by a schoolteacher's description of him as ""idle"". <a href=""https://www.last.fm/music/Billy+Idol"">Read more on Last.fm</a>",2529858,43995801,"['Generation X', 'Duran Duran', 'The Police', 'INXS', 'Foreigner']"
272,Barua," <a href=""https://www.last.fm/music/Barua"">Read more on Last.fm</a>",2871,27351,"['Samurai Resistance', 'Quil', 'RIZARDI', 'Morita yuuhei', 'XANVEL']"
273,late night drive home,"late night drive home is an indie rock band from El Paso, Texas consisting of lead singer Andre Portillo, guitarist Juan ""Ockz"" Vargas, bassist Freddy Baca, and drummer Brian Dolan. Their music captures everything from the complexity of teenage angst to the beauty of youthful joy. With heartfelt lyrics and a gritty sound, late night drive home brings a refreshing presence into the indie rock scene.

The band began in 2019 as a fun project between Ockz and Andre. <a href=""https://www.last.fm/music/late+night+drive+home"">Read more on Last.fm</a>",444195,8768381,"['Mind’s Eye', 'Yot Club', 'High Sunn', 'Phoneboy', 'Strawberry Milk Cult']"
274,Valira,"Valira es el nuevo proyecto de Juan Zanza, guitarrista de La Raíz. Tras
el parón de la banda, el artista se lanza este 2019 con un buen puñado
de canciones propias que darán forma al primer disco del grupo a
mediados de Marzo. Valira defenderá en directo su repertorio por salas
y festivales, con Zanza como frontman centrado en la voz y, sin olvidar
la guitarra, liderando una potente banda de rock.

After Spanish #1 mestizo band La Raíz decided to halt their musical <a href=""https://www.last.fm/music/Valira"">Read more on Last.fm</a>",3490,79390,"['Ciudad Jara', 'Nativa', 'Smoking Souls', 'Carmen 113', 'Comandante Twin']"
275,Poncho K,"Poncho K, nombre artístico de Alfonso Caballero Romero, es un músico de rock nacido en Sevilla cuya música se caracteriza por la contundencia y el surrealismo de sus letras.
Sus influencias van desde Triana a Pata Negra pasando por Extremoduro o Albert Pla y él mismo define su música afirmando: ""Lo mío es rock con pinceladas flamencas, poesía callejera.

Discografía:

* No quiero empates. (2002) BMG
* Destino de pluma y mano. (2003) BMG
* Cuantovaqueré. (2005) BMG <a href=""https://www.last.fm/music/Poncho+K"">Read more on Last.fm</a>",39422,613145,"['Forraje', 'Albertucho', 'Silencio Absoluto', 'Los Reconoces', 'Sinkope']"
276,Sublevados," <a href=""https://www.last.fm/music/Sublevados"">Read more on Last.fm</a>",1608,17555,"['Fe De Ratas', 'Estrago', 'Benito Kamelas', 'Los De Marras', 'Sinkope']"
277,Cableados," <a href=""https://www.last.fm/music/Cableados"">Read more on Last.fm</a>",406,1606,"['Debruces', 'La Marmita', 'La Sombra del Grajo', 'Mala Hierba', 'Txema Benítez']"
278,Ragged Insomnia," <a href=""https://www.last.fm/music/Ragged+Insomnia"">Read more on Last.fm</a>",9672,89090,"['Imagine Dragons', 'Oh The Larceny', 'Reggy Jagger', 'Mushmellow', 'The Faim']"
279,Los Auténticos Decadentes,"Los Auténticos Decadentes (Spanish for ""The Authentic Decadents"") is an Argentine band that mixes ska with Latin American rhythms. The band was formed around 1986 by Cucho and Nito, who invited Gastón to join them.

Their first hit was Veni Raquel, which set the tone for their later lyrics' irreverence and ironic humor. Many of their songs are classic anthems of Argentinian nightlife, such as Corazón, Loco (Tu Forma de Ser), Entregá el Marrón, La Guitarra, Los Piratas, and El Murguero. <a href=""https://www.last.fm/music/+noredirect/Los+Aut%C3%A9nticos+Decadentes"">Read more on Last.fm</a>",262521,4703764,"['Vicentico', 'Los Fabulosos Cadillacs', 'Bersuit Vergarabat', 'Attaque 77', 'Turf']"
280,AJR,"AJR is a New York City-based indie pop band composed of brothers Adam, Jack, and Ryan Met (born Metzger). The band is a DIY pop group who write, produce, and mix their own material in the living room of their Chelsea apartment. Their music style has been described as ""eclectic"", combining elements of pop, barbershop, electronic, and dubstep music. They have opened for Demi Lovato, Hoodie Allen and the Wanted. In Summer 2014 the band went on tour with Lindsey Stirling. <a href=""https://www.last.fm/music/AJR"">Read more on Last.fm</a>",1069743,46298056,"['The Astronomers', 'BoyWithUke', 'American Authors', 'Em Beihold', 'Ryan Mack']"
281,Keanu Bicol," <a href=""https://www.last.fm/music/Keanu+Bicol"">Read more on Last.fm</a>",106113,1960103,"['INOHA', 'Phoneboy', 'Andrew Garden', 'The Rare Occasions', 'Last Dinosaurs']"
282,Citizen Soldier,"Since Citizen Soldier's debut in 2017, the Salt Lake City-based music group has been all about honoring those who fight battles every day that other dismiss or judge them for. Those battling mental illness, abuse, stigmatization, and being ostracized have embraced their music as a representation of their own stories and struggles. As the community has grown and word has spread, many have found a refuge of survivors to share in their pain.

""This Is Your Sign"" captures a pivotal moment for Citizen Soldier. <a href=""https://www.last.fm/music/Citizen+Soldier"">Read more on Last.fm</a>",100185,5092935,"['Lø Spirit', 'Letdown.', 'Self Deception', 'Smash Into Pieces', 'Line So Thin']"
283,Radiohead,"Radiohead are an English alternative rock band formed in Abingdon, Oxfordshire, in 1985. The band consists of Thom Yorke (vocals, guitar, piano, keyboards); brothers Jonny Greenwood (lead guitar, keyboards, other instruments) and Colin Greenwood (bass); Ed O'Brien (guitar, backing vocals); and Philip Selway (drums, percussion). They have worked with the producer Nigel Godrich and the cover artist Stanley Donwood since 1994. Radiohead's experimental approach is credited with advancing the sound of alternative rock. <a href=""https://www.last.fm/music/Radiohead"">Read more on Last.fm</a>",7273071,1068759723,"['Thom Yorke', 'Atoms for Peace', 'Jeff Buckley', 'The Strokes', 'Deftones']"
284,Inhaler,"Inhaler is an alternative rock band formed in 2016 in Dublin  consisting of Elijah Hewson (voc, git), Josh Jenkinson (git), Robert Keating (aka Bobby Skeetz, bass) and Ryan McMahon (dr). The band released their first single, I Want You in 2017. The band were signed to Polydor an English label-- in July 2019 and embarked on their first tour of the US. The band were tipped for success in 2020 when they ranked at number 5 in BBC's Sound of... music poll. <a href=""https://www.last.fm/music/Inhaler"">Read more on Last.fm</a>",442825,22758126,"['Sam Fender', 'Catfish and the Bottlemen', 'Overpass', 'Wunderhorse', 'Blossoms']"
285,Foo Fighters,"Foo Fighters are an American rock band formed in Seattle in 1994. Foo Fighters was initially formed as a one-man project by former Nirvana drummer Dave Grohl. Following the success of the eponymous debut album, Grohl (lead vocals, guitar) recruited a band consisting of Nate Mendel (bass guitar), William Goldsmith (drums), and Pat Smear (guitar). After a succession of lineup changes, including the departures of Goldsmith and Smear, the band formed its core lineup in 1999 consisting of Grohl <a href=""https://www.last.fm/music/Foo+Fighters"">Read more on Last.fm</a>",5723286,302781324,"['Taylor Hawkins & The Coattail Riders', 'Pearl Jam', 'Nirvana', 'Them Crooked Vultures', 'Audioslave']"
286,Lasso,"1) Hardcore punk de Salvador, BA, Brasil
Ordem Imaginada 7” preorder available from @sorrystate (US) and @staticshockrecords (UK)
https://sorrystaterecords.bandcamp.com/album/ordem-imaginada

2) Andrés Vicente Lazo Uslar (Caracas, Venezuela, 18 de febrero de 1988), más conocido por su nombre artístico Lasso, es un cantante, actor y compositor venezolano. <a href=""https://www.last.fm/music/Lasso"">Read more on Last.fm</a>",123558,2484861,"['Danny Ocean', 'Lagos', 'Caramelos de Cianuro', 'Rawayana', 'Los Mesoneros']"
287,WILLOW,"There are at least six artists with this name:
1. Willow Smith, an American pop singer
2. An American instrumental group
3. A Belgian indie rock band
4. An American singer/songwriter
5. A Dutch rock band
6. An American math rock band
7. Sophie Wilson, a UK-based producer.
8. German hard rock band, 1990s.

1. Willow Camille Reign Smith (born October 31, 2000 in Los Angeles, United States) is an American child actress and singer who is the daughter of Will Smith and Jada Pinkett Smith. <a href=""https://www.last.fm/music/Willow"">Read more on Last.fm</a>",1902783,62856581,"['The Anxiety', 'Chloe x Halle', 'Solange', 'Normani', 'Doja Cat']"
288,Saint Chaos," <a href=""https://www.last.fm/music/Saint+Chaos"">Read more on Last.fm</a>",69394,888230,"['Zayde Wølf', 'Adam Jensen', 'JAXSON GAMBLE', ""The People's Thieves"", 'Arrested Youth']"
289,Saint Motel,"Saint Motel (stylized as SAINT MOTEL) is an American alternative rock  band from Los Angeles whose music has been described as everything from ""dream pop"" to ""prog"". The band consists of A/J Jackson (lead vocals, guitar, piano), Aaron Sharp (lead guitar), Dak Lerdamornpong (bass), and Greg Erwin (drums). 

Their debut EP, ForPl, was released in 2009. The band's first full-length album, Voyeur, was released in 2012. 

Their second album, saintmotelevision, was released in 2016.  <a href=""https://www.last.fm/music/Saint+Motel"">Read more on Last.fm</a>",1086058,22747266,"['The Happy Fits', 'I DONT KNOW HOW BUT THEY FOUND ME', 'The Unlikely Candidates', 'Max Frost', 'Dreamers']"
290,Dead Poet Society,"Dead Poet Society is a rock band from Boston, Massachusetts. 

Members:	
Lead vocals/Guitar-Jack Underkofler
Guitar-Jack Collins
Bass-Dylan Brenner
Drums-Will Goodroad <a href=""https://www.last.fm/music/DEAD+POET+SOCIETY"">Read more on Last.fm</a>",223048,6060293,"['Cleopatrick', 'Des Rocs', 'Highly Suspect', 'Electric Enemy', 'Nothing But Thieves']"
291,Friday Pilots Club,"Recently signed to Big Machine/John Varvatos Records (Big Machine Label Group), Friday Pilots Club is Chicago’s Pop affected and hard-hitting Rock band.

Formed in 2017, members Caleb Hiltunen (vocals) and Drew Polovick (guitar) blend explosive memorable hooks and eclectic musical sensibilities to bring a fresh sound to the world of Rock music.

While attending Columbia College Chicago and pursuing different degrees, Caleb and Drew became instant fans of each other’s work. <a href=""https://www.last.fm/music/Friday+Pilots+Club"">Read more on Last.fm</a>",222352,7362582,"['WHALES•TALK', 'Himalayas', 'Airways', 'Betcha', 'The Wrecks']"
292,Wine Lips,"Toronto-based garage punk psych rockers Wine Lips took the stage for the first time in the fall of 2015. Initially, it was a part-time project between songwriter and guitar player Cam Hilborn and drummer Aurora Evans. The band started playing at clubs in Toronto and gradually expanded to surrounding cities and even ventured into Quebec. By mid-2017, it became evident that the band members were ready to commit full-time. Wine Lips released their self-titled debut LP on indie label Fried Records and embarked on their first tour <a href=""https://www.last.fm/music/Wine+Lips"">Read more on Last.fm</a>",191572,1685671,"['Teen Mortgage', 'Stiff Richards', 'Bad Nerves', 'The Clockworks', 'Frankie and the Witch Fingers']"
293,Santana,"Santana is a Latin music and rock band formed in San Francisco, California in 1966 by Mexican-American guitarist Carlos Santana. The band came to public attention with their performance of ""Soul Sacrifice"" at Woodstock in 1969. This exposure helped propel their first album, also named Santana, into a hit, followed in the next two years by Abraxas and Santana III. Lineup changes were common. Carlos Santana's increasing involvement with guru Sri Chinmoy took the band into more esoteric music, though it never lost its Latin influence. <a href=""https://www.last.fm/music/Santana"">Read more on Last.fm</a>",2539943,44270064,"['Carlos Santana', 'Jeff Beck', 'Eric Clapton', 'The Allman Brothers Band', 'Jimi Hendrix']"
294,Kevin Walkman," <a href=""https://www.last.fm/music/Kevin+Walkman"">Read more on Last.fm</a>",130135,2292841,"['Phoneboy', 'adan diaz', 'Mickey Darling', 'The Polar Boys', 'The Happy Fits']"
295,The Dirty Shirts," <a href=""https://www.last.fm/music/The+Dirty+Shirts"">Read more on Last.fm</a>",7878,21567,"['Glum Aleks', 'Philip McHale', 'Hidden Pillars', 'Deane', 'Land Of Valen']"
296,Bayron Caicedo," <a href=""https://www.last.fm/music/Bayron+Caicedo"">Read more on Last.fm</a>",1070,12824,"['Angel Guaraca', 'MARIA DE LOS ANGELES', 'Maximo Escaleras', 'Hipatia Balseca', 'Star Band de Luis Alfredo']"
297,Gary Moore,"Gary Moore (born April 4, 1952 as Robert William Gary Moore in Belfast, Northern Ireland, United Kingdom; died February 6, 2011 in Malaga, Spain) is acknowledged as one of the finest guitarists to have originated in Ireland. He was a virtuoso guitarist and is considered by his fans to be one of the best guitar players ever.

In a career dating back to the 1960s he has played with bands including Thin Lizzy, Colosseum II, Greg Lake and Skid Row as well as having a successful solo career. <a href=""https://www.last.fm/music/Gary+Moore"">Read more on Last.fm</a>",873161,15098022,"['Joe Bonamassa', 'Thin Lizzy', 'Snowy White', 'Philip Sayce', 'Whitesnake']"
298,Heroes Del Silencio,"Héroes del Silencio (sometimes referred to as just Héroes) is a Spanish rock band from Zaragoza (Aragón, Spain) formed by Juan Valdivia. In the 1990s they experienced success around Spain and the Americas, and various European countries including Germany, Belgium, Switzerland, France and Portugal becoming a successful Spanish group and a fact in the history of the Rock en Español scene. After ten years and numerous albums, the band broke up in 1997. <a href=""https://www.last.fm/music/+noredirect/Heroes+Del+Silencio"">Read more on Last.fm</a>",110921,2720025,[]
299,EKKSTACY,"EKKSTACY is Canadian singer-songwriter Khyree Zienty (born 2002) from Vancouver, BC. He describes his current sound as a fuse of indie, post punk, and synth wave. 

Ekkstacy began creating music during high school, taking influence from film, and artists including Elliott Smith, The Drums, Bon Iver, and Bedroom. His music primarily involved youtube beats, in which he sang over. He released his debut EP Negative in November 2021, with the single ""I Walk This Earth All by Myself"" becoming what is considered to be his most popular song. <a href=""https://www.last.fm/music/EKKSTACY"">Read more on Last.fm</a>",753244,15349242,"['thornskin', 'SUMMER ALONE', 'Yot Club', 'kurffew', 'Mind’s Eye']"
300,Still Corners,"Still Corners is a band that formed in 2008 in London, England.  The group consists of duo Tessa Murray (vocals) and Greg Hughes (multi-instrumentalist/producer).  Since 2008 they've been joined by Leon Dufficy (guitar) and Luke Jarvis (bass) for live performances.  Jack Gooderham (drums) joined the live band in 2013.

Still Corners garnered wide critical success with a string of singles including the Don't Fall In Love/Wish 7-inch on cult label the <a href=""https://www.last.fm/music/Still+Corners"">Read more on Last.fm</a>",504507,10131987,"['New Constellations', 'Widowspeak', 'Jonathan Bree', 'Blouse', 'Craft Spells']"
