,nombre_artista,bio,listeners,playcount,similar
0,MAN WITH A MISSION,"MAN WITH A MISSION is a Japanese alternative/rock/pop band formed in Shibuya, Tokyo,  Japan in 2010 consist of TOKYO TANAKA (Vocal), Jean-Ken Johnny (Vocal/Guitar), Kamikaze Boy (Bass), DJ Santa Monica (DJ, Sampling), and SPEAR RIB (Drums). Half-men, half-wolves, the 5 members have taken the world by storm since they entered the underground rock network. The band was signed by a major label in 2011. From then on, they became a real phenomenon: their album and concert tickets almost immediately sell out. <a href=""https://www.last.fm/music/Man+with+a+Mission"">Read more on Last.fm</a>",234689,7281626,[]
1,Bring Me The Horizon,"Bring Me the Horizon is a British rock band formed in Sheffield, England, in 2004. The group currently consists of lead vocalist Oli Sykes, drummer Matt Nicholls, guitarist Lee Malia, and bassist Matt Kean. They are signed to RCA Records globally and to Columbia Records in the United States.

The band released its debut album ""Count Your Blessings"" in 2006. The album featured a deathcore style that received mixed reactions and generally unfavorable reviews from critics. <a href=""https://www.last.fm/music/Bring+Me+the+Horizon"">Read more on Last.fm</a>",2460325,262180013,"['Bad Omens', 'The Plot in You', 'Motionless in White', 'Asking Alexandria', 'Architects']"
2,ONE OK ROCK,"ONE OK ROCK are a Japanese Rock band formed in the summer of 2005. They were started by Toru with High School friends Alex and Ryota after each of them got their musical instruments. After that, Taka joined as their vocalist and they focused on performing shows in the Tokyo area.

In 2006 they independently released 2 mini albums. Because of their albums sales, their participation in relatively large festivals that summer and their energetic shows in the outskirts of Tokyo, they were noticed by a foreign record company. <a href=""https://www.last.fm/music/ONE+OK+ROCK"">Read more on Last.fm</a>",532502,43637481,"['MY FIRST STORY', 'coldrain', 'SPYAIR', 'Survive Said The Prophet', 'MAN WITH A MISSION']"
3,YUNGBLUD,"Dominic Richard Harrison (born 5 August 1997), known professionally as YUNGBLUD (pronounced ""Youngblood""), is an English singer, musician and songwriter. In 2018, he released his first EP, YUNGBLUD, followed shortly after by the album 21st Century Liability.  In 2019, he released another EP, The Underrated Youth. His second album, Weird!, was released in late 2020 and peaked at the top of UK Albums Chart and reached number 75 on US Billboard 200. <a href=""https://www.last.fm/music/Yungblud"">Read more on Last.fm</a>",960544,35846359,[]
4,El Cuarteto De Nos,"El Cuarteto de Nos is an Uruguayan alternative rock band formed in 1984 in Montevideo. The band was originally comprised of the Musso brothers (Roberto and Riki Musso) and Santiago Tavella, who they had met in high school. In 1984 they released their debut album, a split LP with uruguayan candombe musician Alberto Wolf under the Ayuí / Tacuabé label. Leonardo Baroncini was hired to be a guest drummer on the record.

In March 1987 they released Soy una arveja <a href=""https://www.last.fm/music/El+Cuarteto+De+Nos"">Read more on Last.fm</a>",226529,15480040,"['La Vela Puerca', 'No Te Va Gustar', 'Fito Páez', 'Soda Stereo', 'Enanitos Verdes']"
5,Foals,"Foals are a rock band which formed in Oxford, England in 2005.  The band consists of Yannis Philippakis (vocals, guitar), Jimmy Smith (guitar), Walter Gervers (bass) and Jack Bevan (drums). The band has released seven albums: ""Antidotes"" (2008), ""Total Life Forever"" (2010), ""Holy Fire"" (2013), ""What Went Down"" (2015), ""Everything Not Saved Will Be Lost, Pt. 1"" (2019) , ""Everything Not Saved Will Be Lost, Pt. 2"" (2019), and ""Life is Yours"" (2022). In January 2018, it was announced that Walter Gervers (bass) was leaving the band. <a href=""https://www.last.fm/music/Foals"">Read more on Last.fm</a>",1977828,97752962,"['The Maccabees', 'Bombay Bicycle Club', 'White Lies', 'Editors', 'Bloc Party']"
6,Celtian,"Celtian is a folk metal band from Spain founded in 2017 by the flautist Diego Palacio, and led on vocals by the singer Xana Lavey. Their sound is strongly inspired by bands that mix Heavy metal with folk music European as Wizard of Oz, Saurom, , among others. Eluveitie

Celtian
Country of origin:  Spain - Alcalá de Henares, Community of Madrid
Formed in:  2017
Genre:  Symphonic Folk Metal
Current label: Maldito Records

Compilation appearance(s): <a href=""https://www.last.fm/music/Celtian"">Read more on Last.fm</a>",7273,193543,"['Saurom', 'Warcry', 'Mägo de Oz', 'Saratoga', 'Tierra Santa']"
7,Coldplay,"Coldplay is a British alternative rock and britpop band formed in London in 1997. They consist of vocalist and pianist Chris Martin, guitarist Jonny Buckland, bassist Guy Berryman, drummer Will Champion and creative director Phil Harvey. They met at University College London and began playing music together from 1996 to 1998, initially calling themselves Starfish. Coldplay's music incorporates elements of soft rock, pop rock, piano rock, and post-britpop. <a href=""https://www.last.fm/music/Coldplay"">Read more on Last.fm</a>",8106631,630779336,"['Keane', 'Imagine Dragons', 'Snow Patrol', 'OneRepublic', 'Travis']"
8,Dayseeker,"Dayseeker is an American post-hardcore band from Orange County, California, formed in 2012. The band consists of vocalist Rory Rodriguez, guitarist Gino Sgambelluri, bassist Ramone Valerio and drummer Zac Mayfield. They are currently signed to Spinefarm Records and have released five studio albums. Their most recent studio album, Dark Sun, was released on November 4, 2022. <a href=""https://www.last.fm/music/Dayseeker"">Read more on Last.fm</a>",192692,10525196,"['Rain City Drive', 'Too Close to Touch', 'Caskets', 'Thousand Below', 'Wind Walkers']"
9,STARSET,"Starset is an American alternative rock band formed in 2013 in Columbus, Ohio, by lead vocalist and Downplay former member Dustin Bates

The current lineup consistst of: Dustin Bates (lead vocals, keyboards, piano, synths and guitars), Ron DeChant (bass, keyboards and backing vocals), Brock Richards (guitars and backing vocals) and Adam Gilbert (drums and percussion).

They released their debut studio album, Transmissions, in 2014 with the label Razor & Tie, followed by a second studio album, Vessels, in 2017. <a href=""https://www.last.fm/music/Starset"">Read more on Last.fm</a>",456884,22038006,"['Downplay', 'Red', 'Written by Wolves', 'Project Vela', 'Breaking Benjamin']"
10,Wallows,"Wallows is an American alternative rock band based in Los Angeles composed of Dylan Minnette (guitar and vocals), Braeden Lemasters (guitar and vocals), and Cole Preston (drums and vocals). The band began releasing songs independently in April 2017 starting with ""Pleaser"", which reached number two on the Spotify Global Viral 50 chart.

In April 2017, the band released their first single under the Wallows moniker, ""Pleaser"". The song would eventually <a href=""https://www.last.fm/music/Wallows"">Read more on Last.fm</a>",1803111,105315485,"['Dayglow', 'Inhaler', 'Coin', 'Declan McKenna', 'HUNNY']"
11,Cage The Elephant,"Cage the Elephant are an alternative rock band which formed in 2005 in Bowling Green, Kentucky, United States.

The band consists of Matt Shultz (vocals), Brad Shultz (guitar), Nick Bockrath (guitar), Daniel Tichenor (bass, vocals), Jared Champion (drums) and Matthan Minster (keyboard, vocals, guitar). 

Their breakthrough single was Ain't No Rest For The Wicked, which peaked at #83 on the Billboard Hot 100, #32 on the UK Singles Chart and #3 on the Billboard Alternative Songs chart. <a href=""https://www.last.fm/music/Cage+the+Elephant"">Read more on Last.fm</a>",2999745,121932960,"['Young the Giant', 'The Strokes', 'Arctic Monkeys', 'Foster the People', 'The Backseat Lovers']"
12,I Prevail,"I Prevail is an American metalcore band formed in Southfield, Michigan, in 2013. They released their first EP „Heart vs Mind” a year later. Their rise to popularity came after releasing a cover of Taylor Swift’s Blank Space (also in 2014), which ended up reaching certified platinum in the US. Since then, the band has released three albums:
- Lifelines in 2016, which reached #15 on the Billboard 200,
- Trauma in 2019, which became their most successful album yet - receiving both a Best Rock Album Grammy nomination <a href=""https://www.last.fm/music/I+Prevail"">Read more on Last.fm</a>",494248,25264194,"['Wage War', 'Memphis May Fire', 'Beartooth', 'Catch Your Breath', 'We Came as Romans']"
13,The Mystery Lights,"Founded in California and based in Brooklyn, the Mystery Lights play psychedelia-infused garage rock with a deep reverence for the sounds of the '60s but with a dash of contemporary cleverness and plenty of spirit. Full of guitars simmering in fuzz and reverb, vocals that plead or taunt, melodies that are both driving and trippy, and an abundance of lysergic sound effects, the group made their recording debut with 2009's Teenage Catgirls & the Mystery Lightshow <a href=""https://www.last.fm/music/The+Mystery+Lights"">Read more on Last.fm</a>",121441,1162531,"['The Spyrals', 'Jacuzzi Boys', 'Night Beats', 'Mystic Braves', 'Dead Ghosts']"
14,Tame Impala,"Tame Impala is a psychedelic rock band of Australian musician Kevin Parker, who writes, records, produces, and performs. As a touring act, Tame Impala consists of Parker (guitar, vocals), Dominic Simper (guitar, synthesiser), Jay Watson (synthesiser, vocals, guitar), Cam Avery (bass guitar, vocals), and Julien Barbagallo (drums, vocals). Many of the band members, including Parker, are collaborators with fellow Australian psychedelic rock band Pond. <a href=""https://www.last.fm/music/Tame+Impala"">Read more on Last.fm</a>",3600096,309853483,"['Pond', 'GUM', ""Melody's Echo Chamber"", 'Temples', 'MGMT']"
15,Falling In Reverse,"Falling in Reverse is an American rock band based in Las Vegas, Nevada and formed in 2008, signed to Epitaph Records. The band is led currently by vocalist Ronnie Radke alongside bassist Tyler Burgess, lead guitarist Max Georgiev and drummer Luke Holland. 

In 2008, lead singer Ronnie Radke was involved in an altercation in Las Vegas that resulted in the fatal shooting of 18-year-old Michael Cook. While Radke did not shoot Cook, he was indicted on battery charges. <a href=""https://www.last.fm/music/Falling+in+Reverse"">Read more on Last.fm</a>",1143970,54039891,"['Escape The Fate', 'Black Veil Brides', 'Motionless in White', 'Ice Nine Kills', 'Sleeping With Sirens']"
16,Skillet,"Skillet is an American Christian rock band formed in Memphis, Tennessee, in 1996 by vocalist John Cooper and guitarist Ken Steorts.

The current lineup consists of: John Cooper (lead vocals, bass and acoustic guitar), Korey Cooper (keyboards, synthesizer, rythm guitar and backing vocals), Jen Ledger (drums and backing vocals) and Seth Morrison (lead guitar).

History
Foundation and first years
Skillet formed in 1996 with two members: John Cooper, former vocalist for Tennessee progressive rock band Seraph <a href=""https://www.last.fm/music/Skillet"">Read more on Last.fm</a>",1915779,66522561,"['Thousand Foot Krutch', 'Ashes Remain', 'Disciple', 'Red', 'Nine Lashes']"
17,Cam Cole,"The heaviest one-man band in the world is back!

Cam Cole's 3rd album ""Unleash"" is the result of an incredible journey from the streets of London to stages all around the world. Starting out as a busker on every street corner that would allow him to play, Cam’s videos went viral on social media, earning him a loyal fanbase, millions of streams, a cameo in Emmy winning TV show “Ted Lasso” and subsequent tours and festival slots across the UK, Europe, USA, Canada, Mexico etc, selling out club shows in cities he had never been in before. <a href=""https://www.last.fm/music/Cam+Cole"">Read more on Last.fm</a>",56371,493875,"['Black River Delta', 'The Bones of J.R. Jones', 'She Keeps Bees', 'Bror Gunnar Jansson', 'The Wanton Bishops']"
18,Ghost,"There are several artists sharing the moniker Ghost;

1) Ghost, also formerly known as Ghost B.C. in the United States, is a Swedish metal band that was formed in Linköping in 2006. In 2010, they released a three-track demo followed by a 7-inch vinyl titled ""Elizabeth"", and later their debut full-length album Opus Eponymous. The song ""Ritual"" was chosen by Kerrang! as one of ""The 50 Most Evil Songs Ever."" The Grammis-nominated album was widely praised and significantly increased their popularity. <a href=""https://www.last.fm/music/Ghost"">Read more on Last.fm</a>",1435863,132801740,"['Volbeat', 'Iron Maiden', 'Avenged Sevenfold', 'Metallica', 'Ozzy Osbourne']"
19,No Te Va Gustar,"No Te Va Gustar, also known by its initials NTVG, is a rock band from Uruguay. The members are: Emiliano Brancciari (vocals and guitar), Guzmán Silveira (bass and backup vocals), Diego Bartaburu (drums), Gonzalo Castex (percussion), Martín Gíl (trumpet and backup vocals), Denis Ramos (trombone), Mauricio Ortiz (tenor saxophone), Marcel Curuchet (keyboards) and Pablo Coniberti (guitar).

No Te Va Gustar was formed in 1994, when most of its members were around the age of 16. <a href=""https://www.last.fm/music/No+Te+Va+Gustar"">Read more on Last.fm</a>",182392,5360007,"['La Vela Puerca', 'El Cuarteto De Nos', 'Zeballos', 'Jorge Drexler', 'Los Fabulosos Cadillacs']"
20,Foster The People,"Foster the People are an alternative rock band that formed in Los Angeles, California, United States in 2009. The band consists of Mark Foster (vocals, guitar, keyboards), Cubbie Fink (bass, vocals) and Mark Pontius (drums). The band released their debut self-titled EP in January 2011. The band's debut full length album, Torches, was released on May 24, 2011 on Star Time/Columbia. Their first single ""Pumped Up Kicks"" was a sleeper hit during the summer of 2011 and peaked at #1 on the Billboard Alternative Songs Chart <a href=""https://www.last.fm/music/Foster+the+People"">Read more on Last.fm</a>",3357826,103016700,"['Two Door Cinema Club', 'Grouplove', 'Young the Giant', 'Dayglow', 'Saint Motel']"
21,Rival Sons,"
Rival Sons is an American rock band from Long Beach, California. Formed in 2009 from the ashes of Scott Holiday’s previous band The Black Summer Crush that featured vocalist Thomas Flowers (Oleander), Michael Miley, and Robin Everhart. Rival Sons was born when Jay Buchanan was persuaded to try playing rock'n'roll and re-record ‘Before The Fire’. The band currently features bassist Dave Beste after Robin Everhart left in August 2013. Signed to Earache Records the band released their fifth studio album titled Hollow Bones on June 10th <a href=""https://www.last.fm/music/Rival+Sons"">Read more on Last.fm</a>",335111,8029048,"['The Temperance Movement', 'Dirty Honey', 'Goodbye June', 'Black Pistol Fire', 'Graveyard']"
22,Vampire Weekend,"
Vampire Weekend is an indie rock band which formed in February 2006 in New York City, New York, United States. The band consists of Ezra Koenig (vocals, guitar), Chris Baio (bass) and Christopher Tomson (drums). Rostam Batmanglij has left the band in early 2016 to begin solo career, but will continue to collaborate with Ezra. The band has released four albums: ""Vampire Weekend"" (2008), ""Contra"" (2010)"",""Modern Vampires of the City"" (2013) and ""Father of the Bride"" (2019). <a href=""https://www.last.fm/music/Vampire+Weekend"">Read more on Last.fm</a>",3174761,149777376,"['Rostam', 'Arcade Fire', 'Phoenix', 'The Shins', 'Ra Ra Riot']"
23,Bad Wolves,"Bad Wolves is a metal supergroup, composed of lead singer Daniel ""DL"" Laskiewicz (ex-guitarist of The Acacia Strain), guitarists Doc Coyle (ex-God Forbid) and Chris Cain (Bury Your Dead), drummer John Boecklin (ex-Devildriver) , and bassist Kyle Konkiel. 
Their original lead singer, Tommy Vext, was dismissed from the band in January 2021 on account of his political beliefs and accusations of violence against him. Their debut album ""Disobey"" was released on May 11 <a href=""https://www.last.fm/music/Bad+Wolves"">Read more on Last.fm</a>",321600,5741257,"['Through Fire', 'Five Finger Death Punch', 'Silent Theory', 'Tommy Vext', 'Gemini Syndrome']"
24,mgk,"Colson Baker (born April 22, 1990), known professionally as Machine Gun Kelly or mgk, is an American musician, rapper, singer-songwriter and actor from  Ohio.  He is noted for his genre duality across alternative rock with hip hop. mgk released four mixtapes between 2007 and 2010 before signing with Bad Boy Records. He released his debut studio album Lace Up, in 2012, which peaked at number four on the US Billboard 200 and contained his breakout single ""Wild Boy"" (featuring Waka Flocka Flame). <a href=""https://www.last.fm/music/MGK"">Read more on Last.fm</a>",784025,22348558,[]
25,The Backseat Lovers,"The Backseat Lovers are a young alternative rock band from Heber City and Sandy, UT. 

Joshua Harmon: lead vocals and guitar 

Jonas Swanson: lead guitar and vocals 

KJ Ward: bass guitar 

Juice Welch: drummer and background vocals   

The band started when Josh, having heard of local drummer Juice Welch, introduced himself and asked if he wanted to start a band. They immediately started working on arrangements for some of Josh's songs. Later Josh <a href=""https://www.last.fm/music/The+Backseat+Lovers"">Read more on Last.fm</a>",875120,32496740,"['Briston Maroney', 'Flipturn', 'Peach Pit', 'Arcy Drive', 'Sarah and the Sundays']"
26,Stick Figure,"Stick Figure is a reggae band from California. All music is created by singer Scott Woodruff. Until 2009 he lived in Duxbury, Massachusetts, as Stick Figure all alone. After a long trip to NZ and Bali, he 2011 moved to San Diego to put together a band. 2012 he released the 5th Stick Figure album, Burial Ground. It reached no. 1 on iTunes and Billboard Reggae charts, and has songs as 'Breathe' and 'Weight Of Sound (feat. TJ O'Neill) '. The band then toured in USA with other reggae groups. <a href=""https://www.last.fm/music/Stick+Figure"">Read more on Last.fm</a>",260418,5267452,"['Rebelution', 'The Movement', 'Iration', 'The Elovaters', 'Tribal Seeds']"
27,Surf Curse,"A gritty and melodic Nevada-bred guitar-and-drum duo who later became a fixture of Los Angeles' D.I.Y. garage and punk scenes, Surf Curse aligned themselves with the artist-run Danger Collective label where they released albums like 2017's Nothing Yet and 2019's Heaven Surrounds You. The sudden viral success of ""Freaks,"" a song they'd released years earlier, earned them a deal with Atlantic, which issued the band's fourth album, Magic Hour, in 2022. <a href=""https://www.last.fm/music/Surf+Curse"">Read more on Last.fm</a>",1690382,37535287,"['Current Joys', 'Beach Goons', 'The Frights', 'Yot Club', 'Mind’s Eye']"
28,Rulo y la contrabanda," <a href=""https://www.last.fm/music/Rulo+y+la+contrabanda"">Read more on Last.fm</a>",17823,427809,"['Albertucho', 'Forraje', 'EXCESO', 'Barricada Y Rosendo', 'Inconscientes']"
29,Celtas Cortos,"Spanish music group of celtic rock.

It was formed in Valladolid (Castilla y León) in 1986. Eight friends, four of which played in the group Almenara decided to participate in a music contest under the name ""Colectivo Eurofolk"". They won the first prize and continued to play together changing their name to Celtas Cortos.

They won another contest in April 1987, the prize was the production of an album. They shared the prize with two other winners, so they contributed three songs to the album Así es como suena: Folk joven. <a href=""https://www.last.fm/music/Celtas+Cortos"">Read more on Last.fm</a>",97917,1462436,"['Seguridad Social', 'M-Clan', 'Loquillo', 'Fito Y Fitipaldis', 'Platero y tú']"
30,Marea,"Marea is an Spanish rock 'n' roll band formed in Berriozar, Navarra in 1998. 
The members of the band are Kutxi Romero as vocalist, Alen Ayerdi as drummer, César Ramallo on rhytmical guitar, David Díaz (Kolibri) as leading guitar and Eduardo Beaumont (Piñas) as bassist and vocalist.
Marea has recorded five albums since its formation: La Patera (1999), Revolcón (2000), Besos De Perro (2002), 28000 Puñaladas (2004) and Las Aceras Están Llenas De Piojos (2007). <a href=""https://www.last.fm/music/Marea"">Read more on Last.fm</a>",113319,4299933,"['Extremoduro', 'La Fuga', 'Platero y tú', 'Barricada', 'Los Suaves']"
31,The Black Keys,"The Black Keys are an alternative rock  group from Akron, Ohio, United States which formed in 2001, consisting of singer and guitarist Dan Auerbach and drummer Patrick Carney. The band name was inspired by a schizophrenic artist and friend in Akron, who used the term ""black keys"" to describe things he disliked or people he did not trust. The Black Keys have roots in traditional blues and psychedelic rock stylings.

They released their first album, The Big Come Up, in 2002, followed by Thickfreakness in 2003, and Rubber Factory in 2004. <a href=""https://www.last.fm/music/The+Black+Keys"">Read more on Last.fm</a>",3056731,172905235,"['Dan Auerbach', 'The Arcs', 'Black Pistol Fire', 'The Blue Stones', 'The Raconteurs']"
32,Orchestral Manoeuvres In The Dark,"Orchestral Manoeuvres in the Dark (often abbreviated to OMD) are a synthpop group whose founding members are originally from the Wirral, United Kingdom.

The group was founded in 1978 by Andy McCluskey and Paul Humphreys, after they had been involved in several bands, including The Id. Later drummer Malcolm Holmes and saxophonist Martin Cooper joined. McCluskey and Humphreys formed the core of the outfit until 1989, when the group split in two. McCluskey retained the name and continued to record and tour as OMD with a new line-up until 1996 <a href=""https://www.last.fm/music/Orchestral+Manoeuvres+in+the+Dark"">Read more on Last.fm</a>",1107355,18901877,"['The Human League', 'Ultravox', 'Blancmange', 'Heaven 17', 'Erasure']"
33,Mala Hierba,"Mala Hierba is a crossover hardcore band from Panamá

www.instagram.com/malahierbapty
linktr.ee/malahierbapty <a href=""https://www.last.fm/music/Mala+Hierba"">Read more on Last.fm</a>",1396,9784,"['La Sombra del Grajo', 'Txema Benítez', 'descendientes', 'Tocando Techo', 'Cableados']"
34,Eyedress,"Idris Vicuña (born May 28, 1990), professionally recognized as Eyedress, is a Filipino solo musician. Raised in the Philippines, particularly an area he described as a ""ghetto,"" Eyedress began playing the guitar at a young age. He and his family moved to Phoenix, Arizona, where he was introduced to punk music. At age 13, he and his family moved to Orange County, California. There he joined the crust punk band Liberal Underground as a bassist. He moved back to the Philippines at age 15 with his family.  <a href=""https://www.last.fm/music/Eyedress"">Read more on Last.fm</a>",1880345,61375400,"['TV Girl', 'Mac DeMarco', 'paulie leparik', 'late night drive home', 'Cults']"
35,Pugface," <a href=""https://www.last.fm/music/Pugface"">Read more on Last.fm</a>",914,2423,"['Sommerset', 'All Left Out', 'RSI', 'Mumsdollar', 'Foamy Ed']"
36,Los De Marras," <a href=""https://www.last.fm/music/Los+De+Marras"">Read more on Last.fm</a>",13650,386070,"['Benito Kamelas', 'Gritando en Silencio', 'Sinkope', 'No Konforme', 'Fe De Ratas']"
37,Tom Petty,"Thomas Earl Petty (20 October 1950 - 2 October 2017) was an American musician, singer, composer and songwriter best known for fronting Tom Petty and the Heartbreakers. Apart from the band, he released three solo albums: ""Full Moon Fever"" (1989), ""Wildflowers"" (1994) and ""Highway Companion"" (2006). 
 
After working with his early bands The Sundowners, The Epics, and Mudcrutch (which also included future Heartbreakers members Mike Campbell and Benmont <a href=""https://www.last.fm/music/Tom+Petty"">Read more on Last.fm</a>",1723944,27112782,"['Tom Petty and The Heartbreakers', 'Mudcrutch', 'Traveling Wilburys', 'John Mellencamp', 'Warren Zevon']"
38,Reignwolf,"Reignwolf is an American indie and blues rock trio from Seattle, Washington. It consists of the vocalist Jordan Cook, bassist Stacey James Kardash, and drummer Joseph Braley. They are known for their hit 2013 single ""Are You Satisfied?""

In late 2011, guitarist/vocalist Jordan Cook moved to Seattle, Washington, from Saskatoon, Saskatchewan, where he was introduced to David ""Stitch"" Rapaport and Joseph Braley from the band The Mothers Anger. Cook formed the band Reignwolf and invited Rapaport and Braley to join him. <a href=""https://www.last.fm/music/Reignwolf"">Read more on Last.fm</a>",253595,3074085,"['Himalayas', 'Cleopatrick', 'Black Pistol Fire', 'The Blue Stones', 'Tigercub']"
39,Declan McKenna,"Declan McKenna is an English singer, songwriter, and musician from Hertfordshire. He won the Glastonbury Festival's Emerging Talent Competition in 2015.
He writes alternative indie-pop music with influences from artists such as David Bowie. He has toured in the UK, Europe and in the US. 
Declan is known for his outspoken political views, including in his songs such as 'Brazil' which portrays a social commentary on the corruption within the Fifa organisation.  <a href=""https://www.last.fm/music/Declan+Mckenna"">Read more on Last.fm</a>",1270059,41392436,[]
40,blink-182,"Blink-182 are an American punk rock band formed in Poway, California, in 1992. Their current and best-known lineup consists of bassist/vocalist Mark Hoppus, guitarist/vocalist Tom DeLonge, and drummer Travis Barker.

After years of independent recording and touring, including stints on the Warped Tour, the group signed to MCA Records. Their biggest albums, Enema of the State (1999) and Take Off Your Pants and Jacket (2001), saw international success. <a href=""https://www.last.fm/music/blink-182"">Read more on Last.fm</a>",4406351,286643417,"['Box Car Racer', '+44', 'Angels & Airwaves', 'Sum 41', 'New Found Glory']"
